title,price,company,moq,rating,nop,image,link,scrapedAt
High Quality 304g/Box Sweet Sandwich Biscuits Crispy Vanilla Ice Cream Flavor Cookies with Chocolate Cheese Packaged in Bag,17.35-19.28,"Zhengzhou Flyocean E - Commerce Co., Ltd.",Min. order: 10 cartons,nil,nil,https://s.alicdn.com/@sc04/kf/Haf9affcff5ec48abba9594dd69f0eed4V.png_300x300.png,https://www.alibaba.com/product-detail/High-Quality-304g-Box-Sweet-Sandwich_1601251507292.html,2025-02-17T07:52:23.903Z
Exotic snacks Wafer roll biscuits wholesale strawberry vanilla hazelnut rolls chocolate wafer rolls 85g,0.75,"Beijing Aifutaile Import & Export Trade Co., Ltd.",Min. order: 240 boxes,4.6,45 views,https://s.alicdn.com/@sc04/kf/Hfddccee6b3e54e5680d58680c402aa1fy.jpg_300x300.jpg,https://www.alibaba.com/product-detail/Exotic-snacks-Wafer-roll-biscuits-wholesale_1601124198176.html,2025-02-17T07:52:24.198Z
42g Crispy Milk Vanilla/Hazelnut Chocolate Flavor Wafer Sandwich Biscuits Sweet Exotic Snacks in Box Packaging,0.95,"Guangzhou Maidetong Supply Chain Management Co., Ltd.",Min. order: 48 bags,4.9,nil,https://s.alicdn.com/@sc04/kf/H39ddaa8ef6f347fbad6883901d27727ai.jpg_300x300.jpg,https://www.alibaba.com/product-detail/42g-Crispy-Milk-Vanilla-Hazelnut-Chocolate_1601054983868.html,2025-02-17T07:52:24.487Z
Ore0 sandwich biscuits cream vanilla chocolate strawberry blueberry flavor cookies 119.6g,0.95-1.20,"Henan Grade Import And Export Co.,ltd",Min. order: 24 pieces,4.9,nil,https://s.alicdn.com/@sc04/kf/H3b2ff5bd310b4d89a68c3d981ed4a742S.jpg_300x300.jpg,https://www.alibaba.com/product-detail/Ore0-sandwich-biscuits-cream-vanilla-chocolate_1601289579073.html,2025-02-17T07:52:24.708Z
Ore O Chocolate Sandwich Cookies Ore O Wafer Roll Vanilla 54g X 20 Boxes Creme Sandwich Biscuits Made with Real Cocoa,1.00,VSF Sdn Bhd,Min. order: 500 cartons,nil,nil,https://s.alicdn.com/@sc04/kf/A5d0a44df944d42e5b3234f23735cdb55i.jpg_300x300.jpg,https://www.alibaba.com/product-detail/Ore-O-Chocolate-Sandwich-Cookies-Ore_11000009958549.html,2025-02-17T07:52:24.942Z
Franzzis Biscuits Mellow Dark Chocolate Matcha Yogurt Vanilla Cookie 115g,0.75-0.80,"Zhengzhou Well Known Trading Co., Ltd.",Min. order: 48 packs,5.0,nil,https://s.alicdn.com/@sc04/kf/H0160498d33cc4db2b116c3e2b7589653M.jpg_300x300.jpg,https://www.alibaba.com/product-detail/Franzzis-Biscuits-Mellow-Dark-Chocolate-Matcha_1601045075963.html,2025-02-17T07:52:25.233Z
Hersheys Chocolate Sandwich Cookies Hot-Selling Sandwich Vanilla Cream Cookies Exotic Snacks,1.61-1.89,"Henan Ruileibai Import And Export Trading Co., Ltd.",Min. order: 24 packs,4.3,nil,https://s.alicdn.com/@sc04/kf/H31286a8d244e48bbb2dfdcc543c556dbB.jpg_300x300.jpg,https://www.alibaba.com/product-detail/Hersheys-Chocolate-Sandwich-Cookies-Hot-Selling_1601106441883.html,2025-02-17T07:52:25.644Z
Hot Sale Wholesale Oreo Biscuit Cookies Original Chocolate & Vanilla Oreo Biscuits & Cookies SANDWICH,0.95-1.02,"Zhengzhou Onion Trading Co., Ltd.",Min. order: 48 packs,4.9,nil,https://s.alicdn.com/@sc04/kf/Hd60be002d22a4b9c8421707aa947e6f2h.jpg_300x300.jpg,https://www.alibaba.com/product-detail/Hot-Sale-Wholesale-Oreo-Biscuit-Cookies_1601061738192.html,2025-02-17T07:52:26.172Z
Wholesale chocolate flavored matcha flavored vanilla unreleasedoreo 110th birthdayRitz biscuit dessert baked goods 47g,0.90-1.03,Henan Rui Enbo Trading Company Ltd.,Min. order: 24 pieces,4.3,nil,https://s.alicdn.com/@sc04/kf/Hf7fe86227f4f497cb3728974e6835d3eI.jpg_300x300.jpg,https://www.alibaba.com/product-detail/Wholesale-chocolate-flavored-matcha-flavored-vanilla_1600498386438.html,2025-02-17T07:52:26.478Z
Manufacturer Mini Chocolate Vanilla Cream Filled Biscuits Sweets Cookies,2.50,"Guangzhou Lailihong Food Industry Co., Ltd.",Min. order: 600 units,5.0,nil,https://s.alicdn.com/@sc04/kf/Ha49850af18a34b209be1946a36076394E.jpg_300x300.jpg,https://www.alibaba.com/product-detail/Manufacturer-Mini-Chocolate-Vanilla-Cream-Filled_1600052270988.html,2025-02-17T07:52:26.796Z
Original Chocolate Sandwich Cookies with Vanilla Flavored Cream Biscuit hershey Korean snacks 75g,1.60-1.79,"Qingfeng Feining Trading Co., Ltd.",Min. order: 24 pieces,4.5,nil,https://s.alicdn.com/@sc04/kf/Hde3c05c41d034193bc3b5a20eb7f2859P.jpg_300x300.jpg,https://www.alibaba.com/product-detail/Original-Chocolate-Sandwich-Cookies-with-Vanilla_1600878120596.html,2025-02-17T07:52:27.057Z
wholesale biscuits roll Chocolate Flavored Matcha Flavored Vanilla wafer Roll,0.65-0.75,Guangzhou Infinitas Food Technology Company Limited,"Min. order: 2,200 pieces",5.0,nil,https://s.alicdn.com/@sc04/kf/He6172222a9cd4ae8b5d1da5f8fa176207.jpg_300x300.jpg,https://www.alibaba.com/product-detail/wholesale-biscuits-roll-Chocolate-Flavored-Matcha_1600734099426.html,2025-02-17T07:52:27.356Z
Wholesale Hot Sale 15g Cookies Twin Cracker Sandwich Chocolate Cream Vanilla Cocoa Flavors Hard Wafers Square Box Sweet Salty,15.00-15.50,GOURMET FOODS INTERNATIONAL COMPANY LIMITED,Min. order: 200 cartons,nil,nil,https://s.alicdn.com/@sc04/kf/Uc0f8787610f848ab95002e17c2536c55a.jpg_300x300.jpg,https://www.alibaba.com/product-detail/Wholesale-Hot-Sale-15g-Cookies-Twin_1600161653982.html,2025-02-17T07:52:27.650Z
Oreo Cookies Mini 20.4g Enjoy the Perfect Combination of Vanilla and Chocolate Flavors in Every Bite,2.00,G&G CONCEPT COMPANY LIMITED,Min. order: 400 cartons,nil,nil,https://s.alicdn.com/@sc04/kf/A9ac910cc923e45358864816db978c0beN.png_300x300.png,https://www.alibaba.com/product-detail/Oreo-Cookies-Mini-20-4g-Enjoy_10000020988884.html,2025-02-17T07:52:27.886Z
Best Offer for Oreo Biscuit Wafer Roll 54gr with Chocolate/Vanilla,5.00-7.00,M-PACIFIC IMPORT EXPORT JOINT STOCK COMPANY,Min. order: 200 pieces,nil,nil,https://s.alicdn.com/@sc04/kf/Ad75332560abd4b0abb4553ee69de87e2N.png_300x300.png,https://www.alibaba.com/product-detail/Best-Offer-for-Oreo-Biscuit-Wafer_10000022225902.html,2025-02-17T07:52:28.108Z
Wholesale Low Price 58g/box Vanilla Lemon Chocolate Flavored Sandwich Cookies,0.57-0.63,"Zhengzhou Cheerful Trading Co., Ltd.",Min. order: 48 pieces,4.6,nil,https://s.alicdn.com/@sc04/kf/Hc31611ac055b420cbeec436ecced108aT.jpg_300x300.jpg,https://www.alibaba.com/product-detail/Wholesale-Low-Price-58g-box-Vanilla_1600384613471.html,2025-02-17T07:52:28.368Z
vanilla flavored circular cookies OEM mini chocolate biscuit chocolates biscuits sandwich biscuits and cookies,1.32-1.60,"Fujian Blue Star Electronic Commerce Co.,Ltd","Min. order: 3,000 bags",4.9,"8,500 sold",https://s.alicdn.com/@sc04/kf/Hce2ff7ea33924a6ea3aec2f9d5b93156n.jpg_300x300.jpg,https://www.alibaba.com/product-detail/vanilla-flavored-circular-cookies-OEM-mini_1600901943024.html,2025-02-17T07:52:28.605Z
70g Lemon Vanilla Boxed Sandwich Center Filled Biscuits Chocolate Biscuits Turqu Biscuit,0.62-0.69,"Fujian Jihe Supply Chain Co., Ltd.",Min. order: 36 pieces,5.0,nil,https://s.alicdn.com/@sc04/kf/H2bb440fa9b764f1a8133d5ffdc070462U.jpg_300x300.jpg,https://www.alibaba.com/product-detail/70g-Lemon-Vanilla-Boxed-Sandwich-Center_1600618333445.html,2025-02-17T07:52:28.843Z
Vanilla Chocolate 3pcs Oval Cream Sandwich Biscuits Individual Cookie,2.50-2.60,"Shantou Yangyu Foodstuff Co., Ltd.","Min. order: 25,000 pieces",nil,nil,https://s.alicdn.com/@sc04/kf/Haae9ee5d075c44f4a4e85676362f3e58y.jpg_300x300.jpg,https://www.alibaba.com/product-detail/Vanilla-Chocolate-3pcs-Oval-Cream-Sandwich_1601033300126.html,2025-02-17T07:52:29.144Z
Custom China Wholesale Cookie Packing 420g HOKKAIDO Chocolate Vanilla 3pcs Oval Cream Sandwich Biscuits,11.22-12.22,"Guangdong Shangyi Food Co., Ltd.","Min. order: 1,110 cartons",nil,nil,https://s.alicdn.com/@sc04/kf/H59908fbdbb3647a59800ca3c819eaebd7.jpg_300x300.jpg,https://www.alibaba.com/product-detail/Custom-China-Wholesale-Cookie-Packing-420g_1600754077110.html,2025-02-17T07:52:29.526Z
Custom Color Powdered Milkshake Mix 1 OZ Bag Assorted Vanilla Strawberry Raspberry Chocolate Cherry Pineapple Milk Sweet,0.28-0.30,"Zhuhai Gameina Food Co., Ltd.",Min. order: 1 bag,nil,nil,https://s.alicdn.com/@sc04/kf/H81f062aec0b94c24bef1973e8bd78500f.png_300x300.png,https://www.alibaba.com/product-detail/Custom-Color-Powdered-Milkshake-Mix-1_1601256428539.html,2025-02-17T07:52:29.745Z
Wholesale Mondelez Smart Heart Biscuits 47g Vanilla Tira Chocolate Flavored Office Snacks,14.00,"Lanzhou Longshang Rural Agriculture Co., Ltd.",Min. order: 2 barrels,4.8,nil,https://s.alicdn.com/@sc04/kf/H3f8a75b83a3e444b9f150a4ecbe067acs.jpg_300x300.jpg,https://www.alibaba.com/product-detail/Wholesale-Mondelez-Smart-Heart-Biscuits-47g_1600490908707.html,2025-02-17T07:52:29.946Z
Wholesale Exotic Vanilla Strawberry Flavor Wafer Biscuits Chocolate Wafers,0.59-0.69,"Lianyungang Jiayun International Trade Co., Ltd.","Min. order: 10,000 pieces",4.9,nil,https://s.alicdn.com/@sc04/kf/H7c9d41464ba34252a6e26654b91ee06er.jpg_300x300.jpg,https://www.alibaba.com/product-detail/Wholesale-Exotic-Vanilla-Strawberry-Flavor-Wafer_1600863424736.html,2025-02-17T07:52:30.254Z
2023 New Arrival Delicious Vanilla Strawberry Chocolate Mini Biscuit Cookies for Kids,0.20-0.40,Shantou Funnystar Trade Firm,"Min. order: 120,000 pieces",5.0,nil,https://s.alicdn.com/@sc04/kf/Hcda82080add1443a91b781a0434f8f2dP.jpg_300x300.jpg,https://www.alibaba.com/product-detail/2023-New-Arrival-Delicious-Vanilla-Strawberry_1601224213791.html,2025-02-17T07:52:30.502Z
119.6g Oreos Biscuits Cream Vanilla Chocolate Strawberry Blueberry Flavor Sandwich Cookies,1.01-1.03,"Shenzhen Yiguochaopin Trading Co., Ltd.",Min. order: 48 packs,nil,nil,https://s.alicdn.com/@sc04/kf/H514e664107414b2eba3a64b3ef5b88c1i.jpg_300x300.jpg,https://www.alibaba.com/product-detail/119-6g-Oreos-Biscuits-Cream-Vanilla_1601295181333.html,2025-02-17T07:52:31.699Z
Sweet New Formula Bon Choco Chocolate with Vanilla Cream Less Sugar Soft Sponge Cookies Packaged in Bulk Box Egg Cocoa Flavored,1.20-1.35,PHAM NGUYEN CONFECTIONERY COMPANY LIMITED,"Min. order: 4,000 boxes",5.0,nil,https://s.alicdn.com/@sc04/kf/S7e0557f9cd4d48d1ba42869426b8d52b6.jpg_300x300.jpg,https://www.alibaba.com/product-detail/Sweet-New-Formula-Bon-Choco-Chocolate_10000021016197.html,2025-02-17T07:52:31.917Z
Newly Arrival Hot Deal on Best Quality Vanilla Flavor Loacker Quadratini 250 G X 18 Vanilla Wafer Cookie Biscuits,2.14,GUSTI D'ITALIA S.R.L.,Min. order: 1 pallet,nil,nil,https://s.alicdn.com/@sc04/kf/Aa2d0e7ea95a248c5b588e4c1eabeef49H.jpg_300x300.jpg,https://www.alibaba.com/product-detail/Newly-Arrival-Hot-Deal-on-Best_11000008205615.html,2025-02-17T07:52:32.274Z
Factory Wholesale High Quality Chocolate chip cookies 150g Delicious And Healthy,0.80,HAIHA CONFECTIONERY JOINT STOCK COMPANY,"Min. order: 1,000 boxes",nil,nil,https://s.alicdn.com/@sc04/kf/A576b01eef3b940cbbecdc53ad42ff574D.png_300x300.png,https://www.alibaba.com/product-detail/Factory-Wholesale-High-Quality-Chocolate-chip_10000016994894.html,2025-02-17T07:52:33.228Z
Choco Flavor Biscuit Butter Chocolate Cookie Snack Candy,0.80-1.10,"Xiamen Fenglongyuan Trading Co., Ltd.","Min. order: 200,000 bags",nil,nil,https://s.alicdn.com/@sc04/kf/Hc099ef262f5e45d9bd0c1f4687c8ad94J.jpg_300x300.jpg,https://www.alibaba.com/product-detail/Choco-Flavor-Biscuit-Butter-Chocolate-Cookie_1601113959244.html,2025-02-17T07:52:33.470Z
Wholesale Exotic Snacks Chocolate Chip Cookies 85g Biscuits,0.89,"Anhui Elf Food Co., Ltd.","Min. order: 1,000 boxes",nil,nil,https://s.alicdn.com/@sc04/kf/H2042c4c515174643bb3767f56391c530u.jpg_300x300.jpg,https://www.alibaba.com/product-detail/Wholesale-Exotic-Snacks-Chocolate-Chip-Cookies_1601296993205.html,2025-02-17T07:52:33.793Z
[malaysia] Halal Hot Selling Tasty Chocolates Brownie Cookies with Chocolate Cream 160g Per Piece Round Wafer Biscuit Malaysia,88.00-90.00,AWEN GLOBAL SDN. BHD.,Min. order: 1 carton,4.6,nil,https://s.alicdn.com/@sc04/kf/U4c25f998fd474f61a09f998810b1651dx.jpg_300x300.jpg,https://www.alibaba.com/product-detail/-malaysia-Halal-Hot-Selling-Tasty_10000005767280.html,2025-02-17T07:52:34.024Z
Mangehuafu Biscuits Food Biscuit Christmas Cookie Chocolate Chip Best Selling Exotic Snacks Supplier Wafer Cone,0.69-0.86,"Mange lucky (Xiamen) cross border E-commerce Co., Ltd","Min. order: 1,000 bags",nil,11 sold,https://s.alicdn.com/@sc04/kf/Hd8dce8f05dd64fd794ea41394cae03170.jpg_300x300.jpg,https://www.alibaba.com/product-detail/Mangehuafu-Biscuits-Food-Biscuit-Christmas-Cookie_1601194602057.html,2025-02-17T07:52:34.287Z
Milk chocolate with biscuit cookies in cup,8.00-15.00,"Nantong Litai Jianlong Food Co., Ltd.",Min. order: 500 cartons,5.0,nil,https://s.alicdn.com/@sc04/kf/H05085c2926054d05a36a424f4174b9c3G.jpg_300x300.jpg,https://www.alibaba.com/product-detail/Milk-chocolate-with-biscuit-cookies-in_60345285841.html,2025-02-17T07:52:34.946Z
Wholesale mixed chocolate sandwich cookies exotic biscuits baked goods strawberry fruit cocoa healthy,0.85,"Sichuan Cibin Trading Co., Ltd.",Min. order: 240 boxes,4.4,nil,https://s.alicdn.com/@sc04/kf/Hfcc60b935b2c4550aec6a0676b5f150dK.jpg_300x300.jpg,https://www.alibaba.com/product-detail/Wholesale-mixed-chocolate-sandwich-cookies-exotic_1600612148381.html,2025-02-17T07:52:35.229Z
High Protein Vegan Sugar Free Chocolate Berries Earl Grey Tea Sweet Oat Cheese Cookies and Crackers,0.99-1.29,VITAL BEAUTY INTERNATIONAL LIMITED,Min. order: 60 pieces,nil,nil,https://s.alicdn.com/@sc04/kf/Sd7cb6590aa894ac9a82629d85eb0defeO.png_300x300.png,https://www.alibaba.com/product-detail/High-Protein-Vegan-Sugar-Free-Chocolate_1601147031663.html,2025-02-17T07:52:36.914Z
58g Tart Shell Grouted Chocolate Flavored Sandwich biscuit cookie baking ring Soft Biscuits sweet biscuits and,0.28-0.31,"Fuzhou Jiarui Hongxin Trading Co., Ltd.","Min. order: 9,600 pieces",5.0,nil,https://s.alicdn.com/@sc04/kf/H56cec7ac4d934ca3966b3fda43e361d9Y.jpg_300x300.jpg,https://www.alibaba.com/product-detail/58g-Tart-Shell-Grouted-Chocolate-Flavored_1601341418422.html,2025-02-17T07:52:37.214Z
Wholesale Cartoon Cookie Chocolate Sandwich Cookies Biscuit Exotic Snacks Leda Cookie,22.50,"Guangzhou Shiyuan Cross-Border Trade Co., Ltd.",Min. order: 20 cartons,nil,nil,https://s.alicdn.com/@sc04/kf/H2864ba5d268f4b8b9bde4920a89db4b6e.png_300x300.png,https://www.alibaba.com/product-detail/Wholesale-Cartoon-Cookie-Chocolate-Sandwich-Cookies_1601207910833.html,2025-02-17T07:52:37.409Z
Manufacturer Wholesale 12g Chocolate Wafer Biscuit Cookies,0.05-0.50,"Shantou Kingyang Foods Co., Ltd.","Min. order: 200,000 pieces",nil,nil,https://s.alicdn.com/@sc04/kf/H7f251c2a35704152a2814ebf3c62eda15.jpg_300x300.jpg,https://www.alibaba.com/product-detail/Manufacturer-Wholesale-12g-Chocolate-Wafer-Biscuit_1600924068929.html,2025-02-17T07:52:37.600Z
Wholesale High Energy Chocolate Cookie Biscuits Sweet and Delicious Food,1.23-1.90,"Mount Blue Foods Development (Shenzhen) Co., Limited","Min. order: 5,000 cases",nil,nil,https://s.alicdn.com/@sc04/kf/Hb315ebe80edf4c55add1257de7fae465J.jpg_300x300.jpg,https://www.alibaba.com/product-detail/Wholesale-High-Energy-Chocolate-Cookie-Biscuits_1601061427455.html,2025-02-17T07:52:37.753Z
Yixinfoods Chocolate Coated Wafers Biscuit and Cookies Sticks Protein Bar Chocolate Chip Cookies Snack Cracker,0.10-0.25,Guangdong Wingoo Anime Foods Corporation Ltd.,Min. order: 5 boxes,nil,"5,000 sold",https://s.alicdn.com/@sc04/kf/Hd0b7ec03622149c3a41e8b48340e1399t.jpg_300x300.jpg,https://www.alibaba.com/product-detail/Yixinfoods-Chocolate-Coated-Wafers-Biscuit-and_1600620980596.html,2025-02-17T07:52:37.954Z
OEM Crispy Burst Pulp Cookie Chocolate Small Ball Compound Wafer Chocolate Filling Biscuit,1.68-2.68,"Jiangsu Shengyifan Food Technology Co., Ltd.",Min. order: 100 boxes,4.9,nil,https://s.alicdn.com/@sc04/kf/H3e6b2008e4374aeb9e6120b76386f370Y.jpg_300x300.jpg,https://www.alibaba.com/product-detail/OEM-Crispy-Burst-Pulp-Cookie-Chocolate_1600817181796.html,2025-02-17T07:52:38.410Z
Preferential Chocolate Butter Cookies Biscuit Good Taste Chocolate Flavor Butter Cookies,3.77-6.29,"CHAOBY ENTERPRISE CO., LTD.",Min. order: 20 boxes,nil,nil,https://s.alicdn.com/@sc04/kf/Hd08971649e6f462789ee1b962e9b2fa3F.jpg_300x300.jpg,https://www.alibaba.com/product-detail/Preferential-Chocolate-Butter-Cookies-Biscuit-Good_1601187608016.html,2025-02-17T07:52:39.794Z
Chocolate Flavor Delicately Vacuum Packed High Energy Compressed Biscuits,0.40,"Qinhuangdao Ocean Food Co.,Ltd",Min. order: 100 bags,4.8,11 views,https://s.alicdn.com/@sc04/kf/H1dbdbb7076f34852b7864cefbdfbb929C.jpg_300x300.jpg,https://www.alibaba.com/product-detail/Chocolate-Flavor-Delicately-Vacuum-Packed-High_1600223366511.html,2025-02-17T07:52:40.420Z
chocolate coated wafers biscuit crispy biscuits protein bar chocolate chip cookies snack cracker,0.21-0.29,"Guangzhou Yuan Sheng Tang Biotechnology Co., Ltd.","Min. order: 1,000 bags",5.0,nil,https://s.alicdn.com/@sc04/kf/H248e964cbbc44cbf996e978cbb42b78ff.jpg_300x300.jpg,https://www.alibaba.com/product-detail/chocolate-coated-wafers-biscuit-crispy-biscuits_1600868180244.html,2025-02-17T07:52:48.534Z
Wholesale Customization Health Cookies Digestive Biscuit Dark Chocolate Whole Wheat Sugar Free Cookies Waffles Low-Fat Wafers,1.15,"Luohe Huiteman Industrial Co., Ltd",Min. order: 100 bags,nil,nil,https://s.alicdn.com/@sc04/kf/H3ce25598a235434ca0cfaf1a768fc856k.jpg_300x300.jpg,https://www.alibaba.com/product-detail/Wholesale-Customization-Health-Cookies-Digestive-Biscuit_1601198952334.html,2025-02-17T07:52:48.913Z
Wholesale Price 220g Chocolate Orange Flavor Cream Biscuit Cookies,0.55-0.58,"Foshan City Nanhai District Songgang Suifa Food Co., Ltd.","Min. order: 90,000 bags",5.0,nil,https://s.alicdn.com/@sc04/kf/Hf0c341eba37a4b08870f85c535ea1ba9N.jpg_300x300.jpg,https://www.alibaba.com/product-detail/Wholesale-Price-220g-Chocolate-Orange-Flavor_1600271367314.html,2025-02-17T07:52:49.176Z
New Arrival 2025 Nut Biscuit Wholesale Bulk Sugar Honey Vanilla Denmark Recipe Butter Cookie in Blue Box,0.52-0.63,"Zhongshan Xiangxiang Food Co., Ltd.",Min. order: 300 pieces,nil,nil,https://s.alicdn.com/@sc04/kf/H450e25d0f77e4cd2bda19a3e0e0bf2d5k.jpg_300x300.jpg,https://www.alibaba.com/product-detail/New-Arrival-2025-Nut-Biscuit-Wholesale_1601367815462.html,2025-02-17T07:52:49.469Z
Wholesale Exotic Snacks Delicious Chocolate Biscuits 48g Great Quality Cookies,1.41,"Quanyi (shaanxi) Import And Export Trading Co., Ltd.","Min. order: 1,000 bags",nil,nil,https://s.alicdn.com/@sc04/kf/H5fd645eec8b140958ace3727475be6efH.jpg_300x300.jpg,https://www.alibaba.com/product-detail/Wholesale-Exotic-Snacks-Delicious-Chocolate-Biscuits_1600949496474.html,2025-02-17T07:52:49.701Z