title,price,company,moq,rating,nop,image,link,scrapedAt
New Arrival Customized Football Team Logo Rhinestone Heat Transfer Custom Clothing T Shirt High Quality Cotton T Shirts,1.98-7.98,"Mingoalone (Dalian) International Trade Co.,Ltd.",Min. order: 15 pieces,4.8,37 views,https://s.alicdn.com/@sc04/kf/Ha6afee6e697640c4a3aa03c6ea843daaF.png_300x300.png,https://www.alibaba.com/product-detail/New-Arrival-Customized-Football-Team-Logo_1600956490628.html?s=p,2025-02-18T07:42:57.866Z
Dear-Lover Khaki Western Cowboy Print Cuffed Sleeve Crewneck T Shirt,5.36,"Fujian New Shiying E-Commerce Co., Ltd.",Min. order: 2 pieces,4.9,nil,https://s.alicdn.com/@sc04/kf/H9a66d0e8d05546e095940151a7fdefced.jpg_300x300.jpg,https://www.alibaba.com/product-detail/Dear-Lover-Khaki-Western-Cowboy-Print_1601378098787.html,2025-02-18T07:42:58.060Z
China Factory Customized Sparkle Team Graphic Logo Heat Press Rhinestone Transfer OEM Rhinestone Print Cotton T Shirt,1.98-7.98,"Mingoalone (Dalian) International Trade Co.,Ltd.",Min. order: 15 pieces,4.8,4 views,https://s.alicdn.com/@sc04/kf/H525ccfcf891446dd9d8006d4decd8bbbu.png_300x300.png,https://www.alibaba.com/product-detail/China-Factory-Customized-Sparkle-Team-Graphic_1600956579277.html?s=p,2025-02-18T07:42:58.275Z
Quick Dry Men's Power Lifting Grip T-Shirt Custom Logo Barbell Print Strongman Brand O-Neck Short Sleeve Sporty Style,7.25-12.00,KNOCK DOWN INTERNATIONALS,Min. order: 10 pieces,5.0,nil,https://s.alicdn.com/@sc04/kf/S450b891aa3a144b99c350e80bbe8943cz.jpg_300x300.jpg,https://www.alibaba.com/product-detail/Quick-Dry-Men-s-Power-Lifting_10000023127493.html,2025-02-18T07:42:58.471Z
Custom Logo Vintage Acid Washed T Shirt Men Distressed Heavyweight Cotton Blank Oversized Tshirt 100% Cotton for Men's,4.80,"Yiwu Yi Yi Clothing Co., Ltd.",Min. order: 2 pieces,4.8,522 sold,https://s.alicdn.com/@sc04/kf/Hd7c94f470c9e42c3a510e7bf1bd6d3d1B.png_300x300.png,https://www.alibaba.com/product-detail/Custom-Logo-Vintage-Acid-Washed-T_1601194938347.html?selectedCarrierCode=SEMI_MANAGED_STANDARD@@STANDARD,2025-02-18T07:42:59.268Z
Custom Logo Vintage Acid Washed T Shirt DTG DTF Men Heavyweight Cotton Blank Oversized Tshirt 100% Cotton for Men's,4.99,"Yiwu Qunshan Clothing Co., Ltd.",Min. order: 1 bag,4.8,"1,303 sold",https://s.alicdn.com/@sc04/kf/Hec38199ea2874f64b4859cfd4082c1e8N.jpg_300x300.jpg,https://www.alibaba.com/product-detail/Custom-Logo-Vintage-Acid-Washed-T_1601165063873.html?selectedCarrierCode=SEMI_MANAGED_STANDARD@@STANDARD,2025-02-18T07:42:59.639Z
Wholesale Drop Shoulder Blank T Shirt Custom Logo Boxy Fit Men's T-Shirts High Quality Pre-shrunk 100% Heavy Cotton,5.82,"Yiwu Superyou Trading Co., Ltd.",Min. order: 2 pieces,4.8,2 sold,https://s.alicdn.com/@sc04/kf/Hebaaf627d1644d7ebbfcbb6e1071496ej.jpg_300x300.jpg,https://www.alibaba.com/product-detail/Wholesale-Drop-Shoulder-Blank-T-Shirt_1601250083565.html?selectedCarrierCode=SEMI_MANAGED_STANDARD@@STANDARD,2025-02-18T07:43:00.338Z
Spring Summer New Heavyweight 100% Cotton Loose Vintage T Shirt Custom Men Vintage Oversized Tshirt for Men,9.99,"Fuzhou Gelan Garment Co., Ltd.",Min. order: 10 pieces,4.7,66 sold,https://s.alicdn.com/@sc04/kf/H98b082082f3143d381bcce0ce12625997.jpg_300x300.jpg,https://www.alibaba.com/product-detail/Spring-Summer-New-Heavyweight-100-Cotton_1600671176087.html?selectedCarrierCode=SEMI_MANAGED_STANDARD@@STANDARD,2025-02-18T07:43:00.738Z
Wholesale Stock Cheap Quick Dry 100% Polyester Plain Blank Men's Custom Logo Printed Logo Custom Men T Shirts,0.90,"Suzhou Dreamcolor Textile Co., Ltd.",Min. order: 5 pieces,4.3,437 sold,https://s.alicdn.com/@sc04/kf/Hcec1b002d1184a65a445d0a4cf911dceI.jpg_300x300.jpg,https://www.alibaba.com/product-detail/Wholesale-Stock-Cheap-Quick-Dry-100_1601184347709.html?selectedCarrierCode=SEMI_MANAGED_STANDARD@@STANDARD,2025-02-18T07:43:01.433Z
High Quality TOP Sale Cotton Custom T Shirt for Men Blank 100% Cotton T Shirt Printing Men's,2.79,"Yiwu Qishirt Garment Co., Ltd.",Min. order: 2 pieces,4.9,10 sold,https://s.alicdn.com/@sc04/kf/Hdd41c0de33574d2e968bc3a86ea646aaW.jpg_300x300.jpg,https://www.alibaba.com/product-detail/High-Quality-TOP-Sale-Cotton-Custom_1601217797966.html?selectedCarrierCode=SEMI_MANAGED_STANDARD@@STANDARD,2025-02-18T07:43:01.692Z
Your Own Brand Heat Transfer Customize Tee Shirts Custom T Shirt Printing Blank Shirt With Rhinestone Team Logo,1.98-7.98,"Mingoalone (Dalian) International Trade Co.,Ltd.",Min. order: 15 pieces,4.8,35 views,https://s.alicdn.com/@sc04/kf/He2c730f8e6c74d9294ba3bd2bfae5ebdD.png_300x300.png,https://www.alibaba.com/product-detail/Your-Own-Brand-Heat-Transfer-Customize_1600956485649.html?s=p,2025-02-18T07:43:01.921Z
Sublimation White T Shirt for Sublimation US Size Short Sleeve Adults 100% Polyester Blank Sublimation T Shirts,12.80-17.80,Yiwu Kaimai Machinery Equipment Factory,Min. order: 12 pieces,4.7,1 sold,https://s.alicdn.com/@sc04/kf/H0b82a68fac8a44d98bdfdcca58ba296fg.jpg_300x300.jpg,https://www.alibaba.com/product-detail/Sublimation-White-T-Shirt-for-Sublimation_1601046210561.html?selectedCarrierCode=SEMI_MANAGED_STANDARD@@STANDARD,2025-02-18T07:43:02.233Z
CB02- 69000 High Quality 220gsm100% Cotton t Shirt Tee Shirt Printing Custom T Shirt With Your Logo Free Label Print and Cards,5.99,"Yiwu Custom Brand Commodity Co., Ltd.",Min. order: 2 pieces,4.8,11 sold,https://s.alicdn.com/@sc04/kf/H3b46724cdfc84e6182c5b65f23b476e3X.jpg_300x300.jpg,https://www.alibaba.com/product-detail/CB02-69000-High-Quality-220gsm100-Cotton_1601237789336.html?selectedCarrierCode=SEMI_MANAGED_STANDARD@@STANDARD,2025-02-18T07:43:02.499Z
180g Cotton Oem Manufacturer High Quality 100% Cotton Custom Logo Oversized Tshirt 3d Puff Print T Shirt Puff Print t Shirt,7.95,"Fuzhou Cangshan District Sandian Trading Co., Ltd.",Min. order: 2 pieces,4.7,1 sold,https://s.alicdn.com/@sc04/kf/H615164161eea4773b618cfc99d32a9cdA.png_300x300.png,https://www.alibaba.com/product-detail/180g-Cotton-Oem-Manufacturer-High-Quality_1601012501237.html?selectedCarrierCode=SEMI_MANAGED_STANDARD@@STANDARD,2025-02-18T07:43:02.757Z
Hot Sell Puff Printing Blank Tee Shirt Men Plain Heavyweight Cotton Custom Logo Oversize Plain Graphic Sublimation Mens,4.21,"Jinjiang Ximeng Clothing Co., Ltd.",Min. order: 2 pieces,4.7,118 sold,https://s.alicdn.com/@sc04/kf/Sa42f1f733944436cbf3984c87d46f4b9f.jpg_300x300.jpg,https://www.alibaba.com/product-detail/Hot-Sell-Puff-Printing-Blank-Tee_10000018021100.html?selectedCarrierCode=SEMI_MANAGED_STANDARD@@STANDARD,2025-02-18T07:43:02.976Z
Cotton Drop Shoulder Oversize T-shirt Man 250 300gsm Graphic t Shirts Round Neck Cropped Custom Screen Print Boxy t Shirt,7.99,"Fuzhou Jiaxing Youpin International Trade Co., Ltd.",Min. order: 2 pieces,4.7,65 sold,https://s.alicdn.com/@sc04/kf/H855424b187cb4a25a16aacc82006774fx.jpg_300x300.jpg,https://www.alibaba.com/product-detail/Cotton-Drop-Shoulder-Oversize-T-shirt_1601074005465.html?selectedCarrierCode=SEMI_MANAGED_STANDARD@@STANDARD,2025-02-18T07:43:03.211Z
OEM Blank Economic Polyester T-shirt for Presidential Campaigns T-shirts Cheap Election Campaign Tshirt Promotional Custom logo,0.59,"Shenzhen Chuangjiayi E-Commerce Co., Ltd.",Min. order: 100 pieces,4.7,6 sold,https://s.alicdn.com/@sc04/kf/Hb0db02ac821f43cf9d2f572d7b8596d73.jpg_300x300.jpg,https://www.alibaba.com/product-detail/OEM-Blank-Economic-Polyester-T-shirt_1601012235049.html?selectedCarrierCode=SEMI_MANAGED_STANDARD@@STANDARD,2025-02-18T07:43:03.495Z
Heavyweight Over Size T-shirt Cotton Tshirt Custom Graphic Boxy Fit Blank Oversized Cropped Men T Shirt,8.38,"Fuzhou Fmec Industry Co., Ltd.",Min. order: 2 pieces,4.9,122 sold,https://s.alicdn.com/@sc04/kf/H29a733e6fbbe41e399c974006484a4b4M.png_300x300.png,https://www.alibaba.com/product-detail/Heavyweight-Over-Size-T-shirt-Cotton_1601224034045.html?selectedCarrierCode=SEMI_MANAGED_STANDARD@@STANDARD,2025-02-18T07:43:03.745Z
Sublimation Shirts 100 Polyester Cotton Feel US Size Blank Polyester Custom Tshirts logo Printing for Sublimation t Shirts Plain,0.41-0.97,"Guangzhou Fenqi Leather Co., Ltd.",Min. order: 3 pieces,4.7,"52,076 sold",https://s.alicdn.com/@sc04/kf/H490c14cc1c4f41a89d1d447823ac34bcS.jpg_300x300.jpg,https://www.alibaba.com/product-detail/Sublimation-Shirts-100-Polyester-Cotton-Feel_1600471352187.html,2025-02-18T07:43:04.090Z
Washed Custom T Shirt Wholesale Blank Vintage Tee Graphic Men Oversized Tshirt Hip Hop 100% Cotton Heavyweight Acid Wash,7.78,"Dongguan Flya Sports Goods Co., Ltd.",Min. order: 10 pieces,4.8,"1,333 sold",https://s.alicdn.com/@sc04/kf/H01c8c072e6d9419ab925da7c6417c4baE.jpg_300x300.jpg,https://www.alibaba.com/product-detail/Washed-Custom-T-Shirt-Wholesale-Blank_1600644051763.html?selectedCarrierCode=SEMI_MANAGED_STANDARD@@STANDARD,2025-02-18T07:43:04.337Z
Screen Print Unisex Black Blank 100% Cotton 180Gsm White Plain Custom T Shirt Men'S For Men Pour Hommes High Quality,2.73-3.76,"Guangzhou City Basic Clothing Co., Ltd.",Min. order: 1 piece,4.0,53 sold,https://s.alicdn.com/@sc04/kf/A5f05263e659c4e8788e02f5af18f956eU.jpg_300x300.jpg,https://www.alibaba.com/product-detail/Screen-Print-Unisex-Black-Blank-100_1600931372855.html?selectedCarrierCode=SEMI_MANAGED_STANDARD@@STANDARD,2025-02-18T07:43:04.545Z
Custom Men's Tshirt Streetwear 300gsm Boxy Fit High Quality Oversized 100%cotton Crewneck Heavyweight Vintage t Shirt for Men,7.50,"Pujiang Shengwending Garment Co., Ltd.",Min. order: 30 pieces,4.8,nil,https://s.alicdn.com/@sc04/kf/Hecd117d990dc4be996be8a9f3eecf67bv.jpg_300x300.jpg,https://www.alibaba.com/product-detail/Custom-Men-s-Tshirt-Streetwear-300gsm_1601201978736.html?selectedCarrierCode=SEMI_MANAGED_STANDARD@@STANDARD,2025-02-18T07:43:04.798Z
Plain Men's t Shirt Polyester Tee Quick Dry Fit Tshirts Custom Sublimation Printing logo Unisex Gym Sports for Men,0.90-1.80,"Fuzhou Shengshi RuiChuang industry and Trade Co., Ltd",Min. order: 20 pieces,4.8,"7,160 sold",https://s.alicdn.com/@sc04/kf/H57ac48784aec45708d457de742d38757J.jpg_300x300.jpg,https://www.alibaba.com/product-detail/Plain-Men-s-t-Shirt-Polyester_62445804051.html,2025-02-18T07:43:04.990Z
Customize Oversized Vintage T-shirt Wholesale Men Acid Wash Streetwear Hip Hop Stone 100% Cotton T Shirts With Logo,5.98,"Fuzhou Hahajing E-Commerce Co., Ltd.",Min. order: 2 pieces,4.8,48 sold,https://s.alicdn.com/@sc04/kf/Hecdcb85862134d10b3d7be9fcf5f01bei.jpg_300x300.jpg,https://www.alibaba.com/product-detail/Customize-Oversized-Vintage-T-shirt-Wholesale_1601083363989.html?selectedCarrierCode=SEMI_MANAGED_STANDARD@@STANDARD,2025-02-18T07:43:05.188Z
Mens Washed Vintage T-shirt Wholesale Blank Cotton Acid Wash Tshirt Personalized Custom Vintage Graphic t Shirts,2.35,"Yiwu Subking Technology Co., Ltd.",Min. order: 30 pieces,4.1,467 sold,https://s.alicdn.com/@sc04/kf/He9138265cdd748e6b5666c4d273d0c067.jpg_300x300.jpg,https://www.alibaba.com/product-detail/Mens-Washed-Vintage-T-shirt-Wholesale_1601010853098.html,2025-02-18T07:43:05.424Z
BY39000 Custom Logo Printed 100%Cotton Luxury Quality Loose Fit Little Brand Blank Oversized Men T Shirt for Unisex,1.98-2.88,"Fuzhou HG Textile CO.,Ltd",Min. order: 2 pieces,4.6,5 sold,https://s.alicdn.com/@sc04/kf/H3071b291fc7140beacbfc3e949c6e3e4s.jpg_300x300.jpg,https://www.alibaba.com/product-detail/BY39000-Custom-Logo-Printed-100-Cotton_1601204922635.html?selectedCarrierCode=SEMI_MANAGED_STANDARD@@STANDARD,2025-02-18T07:43:05.586Z
Customized Fashion Printing High Quality Polyester Men's Hot Models Comfortable Versatile Casual Men's,3.18-4.00,Shishi City Naifei Clothing Firm (Individual Business),Min. order: 500 bags,5.0,nil,https://s.alicdn.com/@sc04/kf/Hfa0c648fb7ad4504816b9223c9a1958av.png_300x300.png,https://www.alibaba.com/product-detail/Customized-Fashion-Printing-High-Quality-Polyester_1601330242097.html,2025-02-18T07:43:05.770Z
OEM Manufacturer Custom Logo 180 GSM 100% Cotton High Quality Tshirt Short Sleeve Oversized Print for Men,4.11,"Fuzhou Cangshan Jiufeite Import And Export Trade Co., Ltd.",Min. order: 30 pieces,4.8,128 sold,https://s.alicdn.com/@sc04/kf/Hd0b2f247a43e4950a448d11a61173ea6l.jpg_300x300.jpg,https://www.alibaba.com/product-detail/OEM-Manufacturer-Custom-Logo-180-GSM_1601281449989.html,2025-02-18T07:43:05.959Z
Luxury t Shirt High Quality 100% Cotton 250gsm t Shirts 19 Colors Men Women Customizable Blank Casual T Shirt Men's s,4.05,"Fuzhou Xinglan Clothing Co., Ltd.",Min. order: 2 pieces,4.6,283 sold,https://s.alicdn.com/@sc04/kf/H5a53722212b34c8bb74b66556f5f04e1K.jpg_300x300.jpg,https://www.alibaba.com/product-detail/Luxury-t-Shirt-High-Quality-100_1600904025109.html?selectedCarrierCode=SEMI_MANAGED_STANDARD@@STANDARD,2025-02-18T07:43:06.142Z
New Arrival 100% Cotton T-shirt Custom Design Brand Sweatshirts Heavyweight Unisex Shirt High Quality Blank Shirt Wholesale,3.68,"Yiwu 90 Clothing Co., Ltd.",Min. order: 2 pieces,4.8,5 sold,https://s.alicdn.com/@sc04/kf/H94794fc2c23a4915877397975befc5f08.jpg_300x300.jpg,https://www.alibaba.com/product-detail/New-Arrival-100-Cotton-T-shirt_1601229494079.html?selectedCarrierCode=SEMI_MANAGED_STANDARD@@STANDARD,2025-02-18T07:43:06.327Z
Custom Puff Printed logo 250 Gsm T-shirt for Tee Heavy 100% Cotton Unisex Streetwear Heavyweight Oversized Graphic Men T Shirt,4.86,"Quanzhou Aiermi Information Technology Co., Ltd.",Min. order: 5 pieces,4.7,266 sold,https://s.alicdn.com/@sc04/kf/Hb74e6e80ff314289a4e6a6248cefa57ei.png_300x300.png,https://www.alibaba.com/product-detail/Custom-Puff-Printed-logo-250-Gsm_1600689675810.html,2025-02-18T07:43:06.516Z
Blank Unisex T Shirt Promotional T-shirt Unbranded Tshirts,3.03,"Shenzhen Manchu Industrial Co., Ltd.",Min. order: 1 piece,4.9,nil,https://s.alicdn.com/@sc04/kf/H001e4e8dbf504f54b371982cc09332e5m.jpg_300x300.jpg,https://www.alibaba.com/product-detail/Blank-Unisex-T-Shirt-Promotional-T_1601103071035.html?selectedCarrierCode=SEMI_MANAGED_STANDARD@@STANDARD,2025-02-18T07:43:06.690Z
Goldtex Hot High Quality Sale 210 Gsm T-Shirt Pour Les Hommes Printing Custom 100 Cotton Men Blank Casual T Shirt for Men,1.00-3.40,"Zhangjiagang Goldtex International Imp. & Exp. Co., Ltd.",Min. order: 2 pieces,4.6,"2,037 sold",https://s.alicdn.com/@sc04/kf/H1af11f10dde340439459648b447923c6D.jpg_300x300.jpg,https://www.alibaba.com/product-detail/Goldtex-Hot-High-Quality-Sale-210_1601153246120.html,2025-02-18T07:43:06.888Z
HIPHOPPLEIN Wholesale 230GSM Blank 100% Cotton T-shirts Batik Short-sleeved Vintage t Shirt Oversized Men's Acid Washed,4.40,Guangzhou City Yuexiu District Manhao Clothing Firm,Min. order: 2 pieces,4.9,"7,128 sold",https://s.alicdn.com/@sc04/kf/Ha5e24b38fa484fb19a3e810ba6ee48a1q.jpg_300x300.jpg,https://www.alibaba.com/product-detail/HIPHOPPLEIN-Wholesale-230GSM-Blank-100-Cotton_1601004729806.html,2025-02-18T07:43:07.062Z
230gsm Combed Compact Cotton Yarns t Shirt Custom Embossed Long Sleeve Heavy Weight Thermal Waffle Knit,5.66-9.99,"Dongguan Vim Garment Ltd., Co.",Min. order: 300 pieces,4.9,5 sold,https://s.alicdn.com/@sc04/kf/H5379ceb03f1140f192751b3004356778x.png_300x300.png,https://www.alibaba.com/product-detail/230gsm-Combed-Compact-Cotton-Yarns-t_1600828498951.html,2025-02-18T07:43:07.266Z
MT2006 Free OEM Sample Unisex 100% Pure Cotton Printing Custom Graphic T Shirts Men T Shirts in Bulk,4.59-5.59,"Guangzhou Qisong Apparel Co., Ltd.",Min. order: 2 pieces,4.8,2 sold,https://s.alicdn.com/@sc04/kf/H0581ecbe85954d82bc3df9d7281d7ff3I.jpg_300x300.jpg,https://www.alibaba.com/product-detail/MT2006-Free-OEM-Sample-Unisex-100_1600317044260.html,2025-02-18T07:43:07.453Z
Personalized on Demand 200 Gsm Cotton Uomo Cheap Plain t Shirts for Printing Customs Round Neck Basic,4.00,"Shenzhen Qixiao Technology Co., Ltd.",Min. order: 25 pieces,4.9,56 sold,https://s.alicdn.com/@sc04/kf/H1bdbcf50dc554390a2ffbe32462a3e8eb.jpg_300x300.jpg,https://www.alibaba.com/product-detail/Personalized-on-Demand-200-Gsm-Cotton_1601197260569.html?selectedCarrierCode=SEMI_MANAGED_STANDARD@@STANDARD,2025-02-18T07:43:07.710Z
Oversized Men's T-Shirt Manufacturer Print Heavyweight 300 280 250 240 Gsm T Shirt 300Gsm Cotton Custom Heavy Weight Tshirt Men,6.55,"Hangzhou Tongsheng Fashion Co., Ltd.",Min. order: 2 pieces,4.7,"1,779 sold",https://s.alicdn.com/@sc04/kf/H5e5f730d06ac49e1a3f5e72e886a2894s.jpg_300x300.jpg,https://www.alibaba.com/product-detail/Oversized-Men-s-T-Shirt-Manufacturer_1600548731850.html,2025-02-18T07:43:07.904Z
Custom Camouflage Tshirt Digital Print Graphic Tee Vintage Washed Heavyweight Cotton Cropped Boxy Real Tree Camo T Shirts Men,12.99,"Dongguan City Theshow Garment Co., Ltd.",Min. order: 50 pieces,4.9,40 sold,https://s.alicdn.com/@sc04/kf/H2e007141c9fc4e41bf0f455a9b172822v.jpg_300x300.jpg,https://www.alibaba.com/product-detail/Custom-Camouflage-Tshirt-Digital-Print-Graphic_1601250652813.html,2025-02-18T07:43:08.175Z
Streetwear Designer Fit T-shirt Custom Logo 100% Cotton Plus Size Relaxed Casual Breathable 230Gsm 36 Colors Unisex T Shirt,4.59,"Fuzhou Jicai Clothing Co., Ltd.",Min. order: 50 pieces,4.8,"1,081 sold",https://s.alicdn.com/@sc04/kf/H7563675139894eb1a421753c35663807k.jpg_300x300.jpg,https://www.alibaba.com/product-detail/Streetwear-Designer-Fit-T-shirt-Custom_1601000258697.html,2025-02-18T07:43:08.406Z
Wholesale Customize Logo Print Cotton Tshirts Short Sleeve T Shirt Solid Men and Women Blank Shirt,3.60,"Quanzhou Jinke Garments Co., Ltd.",Min. order: 2 pieces,4.4,333 sold,https://s.alicdn.com/@sc04/kf/Hcd9ecddf3af543a7ab02d8d86fd5281bD.jpg_300x300.jpg,https://www.alibaba.com/product-detail/Wholesale-Customize-Logo-Print-Cotton-Tshirts_1601152668993.html,2025-02-18T07:43:08.650Z
High Quality 100% Cotton 190 GSM Solid Color Men Women Unisex Customizable Blank Casual T Shirt Men's,4.50,"Dongguan Rainbow Touches Garment Co., Ltd.",Min. order: 2 pieces,4.2,5 sold,https://s.alicdn.com/@sc04/kf/H078ae9cb733747c799d4f00c971949f69.jpg_300x300.jpg,https://www.alibaba.com/product-detail/High-Quality-100-Cotton-190-GSM_1600480614917.html?selectedCarrierCode=SEMI_MANAGED_STANDARD@@STANDARD,2025-02-18T07:43:08.801Z
100% Polyester Custom logo Gym Sportswear Workout Clothing Fitness Athletic Excise Training for Men,2.70,"Guangzhou Hengdong Sports Goods Co., Ltd.",Min. order: 3 pieces,4.8,6 sold,https://s.alicdn.com/@sc04/kf/H99dacae64f8b4c8daa16cc8653d96bfdb.jpg_300x300.jpg,https://www.alibaba.com/product-detail/100-Polyester-Custom-logo-Gym-Sportswear_1601106904139.html?selectedCarrierCode=SEMI_MANAGED_STANDARD@@STANDARD,2025-02-18T07:43:08.947Z
Heavyweight Cotton Blank Youth Uniform School T Shirt Streetwear Cotton Quality T Shirt,3.50,"Shishi Wansilv Chemical Fiber Product Co., Ltd.",Min. order: 2 pieces,4.9,nil,https://s.alicdn.com/@sc04/kf/Ha5d9356c051a4cd4b9510dc1ce8129a7U.jpg_300x300.jpg,https://www.alibaba.com/product-detail/Heavyweight-Cotton-Blank-Youth-Uniform-School_1600768752881.html?selectedCarrierCode=SEMI_MANAGED_STANDARD@@STANDARD,2025-02-18T07:43:09.108Z
Custom Design Logo Graphic Digital Printing Embroidery Screen Combed Cotton Unisex Tshirt,3.18,"Fuzhou Yingni Clothing Co., Ltd.",Min. order: 20 pieces,4.6,1 sold,https://s.alicdn.com/@sc04/kf/H545d83a24b064757be07171e3a57d659g.jpeg_300x300.jpeg,https://www.alibaba.com/product-detail/Custom-Design-Logo-Graphic-Digital-Printing_1601042896856.html?selectedCarrierCode=SEMI_MANAGED_STANDARD@@STANDARD,2025-02-18T07:43:09.284Z
Free Sample Custom Tshirt Printing Light Laser Reflective Graphic logo Luxury t Shirt 100% Cotton Plain Plus Size Men's,2.70-5.60,"Fuzhou Jifengjie Trade Co., Ltd.",Min. order: 20 pieces,4.8,27 views,https://s.alicdn.com/@sc04/kf/H4c496f88bf11460f86f41576639bcf3e3.jpg_300x300.jpg,https://www.alibaba.com/product-detail/Free-Sample-Custom-Tshirt-Printing-Light_1600213627995.html,2025-02-18T07:43:09.479Z
Heavyweight Mix Color Short Sleeve Plain T-Shirts Men Cheap Promotional T Shirts,1.98-2.99,"Xiamen Heyuansheng Trading Co., Ltd.",Min. order: 200 pieces,3.9,nil,https://s.alicdn.com/@sc04/kf/Ha754b06b6c784bd9bac61886f4399a06r.png_300x300.png,https://www.alibaba.com/product-detail/Heavyweight-Mix-Color-Short-Sleeve-Plain_1601333411282.html,2025-02-18T07:43:09.643Z
Free Blank Samples Customised Logo Promotional Dryfit Sublimation Colorful Polyester Cotton Feel T Shirt Unisex Tee Blank Shirts,0.81-1.98,Gift In Collections Limited,Min. order: 100 pieces,4.4,nil,https://s.alicdn.com/@sc04/kf/Hcf8630d284a3474fbd86349099628857N.jpg_300x300.jpg,https://www.alibaba.com/product-detail/Free-Blank-Samples-Customised-Logo-Promotional_1601161877057.html,2025-02-18T07:43:09.882Z