title,price,company,moq,rating,nop,image,link,scrapedAt
Fashion Women Slim Half-body Skirt Comfortable Sexy Color Casual High Waist Split,4.90,"Guangzhou Panding Trading Co., Ltd.",Min. order: 50 pieces,nil,0,https://s.alicdn.com/@sc04/kf/H81d9daf444bc48ac8ffbec0ab2560e8aT.png_300x300.png,https://www.alibaba.com/product-detail/Fashion-Women-Slim-Half-body-Skirt_1601301836611.html?s=p,2025-02-19T09:48:40.041Z
2in1 Pleated Tennis Skirt Built in Shorts Women's High Waist Athletic Golf for Running Casual,8.00,"Guangzhou Xintiandi Clothing Co., Ltd.",Min. order: 50 pieces,4.9,0,https://s.alicdn.com/@sc04/kf/He956d48474f348e58fdaa305c7afdefa6.jpg_300x300.jpg,https://www.alibaba.com/product-detail/2in1-Pleated-Tennis-Skirt-Built-in_1600963229921.html,2025-02-19T09:48:40.217Z
MOK YF071 Women's New Black Glutinous Rice Skirt High Waist A-Shaped Long Slim Dress Breathable Casual Style,42.00,"Dongguan Shunfa Li Plastic Products Co., Ltd.",Min. order: 1 pack,4.8,,https://s.alicdn.com/@sc04/kf/H1f66ab1e2d134b7dbe8dea507c08764eB.jpg_300x300.jpg,https://www.alibaba.com/product-detail/MOK-YF071-Women-s-New-Black_1601363415142.html,2025-02-19T09:48:40.355Z
3D Custom Logo Low Moq Free Sample Sexy Beach Crochet Bikini Beachwear Top and Maxi Cover up Set for Women,7.80-14.80,"Guangzhou Outpace Sportswear Co., Ltd.",Min. order: 50 sets,5.0,0,https://s.alicdn.com/@sc04/kf/H03c229da76ab4917a20500fef2ae21aax.jpg_300x300.jpg,https://www.alibaba.com/product-detail/3D-Custom-Logo-Low-Moq-Free_1601255107515.html,2025-02-19T09:48:40.506Z
Wholesale 2024 New Arrivals Luxuruy PU Women Clothing High Waist Faux Leather Midi,7.86,"Quanzhou Tianyi Clothing Co., Ltd.",Min. order: 1 piece,4.4,,https://s.alicdn.com/@sc04/kf/H937649f9c5f04e909fbf06e890914d1a5.jpg_300x300.jpg,https://www.alibaba.com/product-detail/Wholesale-2024-New-Arrivals-Luxuruy-PU_1600775004817.html?selectedCarrierCode=SEMI_MANAGED_STANDARD@@STANDARD,2025-02-19T09:48:40.641Z
2024 Skirt Women's Midi Skirt High Waist Solid Color Satin Zipper Elegant Summer Dress,7.90,"Foshan Tengxin E-Commerce Co., Ltd.",Min. order: 2 pieces,4.5,,https://s.alicdn.com/@sc04/kf/H51260b3bbcaf41cbb5eb4af37cdbd28ew.jpg_300x300.jpg,https://www.alibaba.com/product-detail/2024-Skirt-Women-s-Midi-Skirt_1601124947952.html?selectedCarrierCode=SEMI_MANAGED_STANDARD@@STANDARD,2025-02-19T09:48:40.767Z
Tie Dye Women's Jean Cargo Skirts Patchwork Multi Pockets Sexy Ladies Jeans Short Denim Cargo Mini for Women,8.20-20.25,"Musen (xiamen) Trading Co., Ltd.",Min. order: 1 piece,4.5,,https://s.alicdn.com/@sc04/kf/H1ff21f8ca562431491e012ee3b0c808fi.jpg_300x300.jpg,https://www.alibaba.com/product-detail/Tie-Dye-Women-s-Jean-Cargo_1600863360386.html?selectedCarrierCode=SEMI_MANAGED_STANDARD@@STANDARD,2025-02-19T09:48:40.931Z
Cotton Ribbed Outfits 2 Piece Skirt Set Women Skirt Maxi Essential Loungewear Women Sets,16.80,"Qingdao Shuangling Garment Co., Ltd.",Min. order: 30 sets,4.8,0,https://s.alicdn.com/@sc04/kf/H07ff71b4ec4845f5a6621acf80b45c63h.jpg_300x300.jpg,https://www.alibaba.com/product-detail/Cotton-Ribbed-Outfits-2-Piece-Skirt_1601259396772.html,2025-02-19T09:48:41.089Z
Fall New Half Skirt French Khaki PU Leather Skirt Women Simple Slit High Waist Straight,13.50-15.25,"Dongguan Jimuni Apparel Co., Ltd.",Min. order: 50 pieces,4.5,0,https://s.alicdn.com/@sc04/kf/H5b49bbc9d34049c79e831b88ba9ca5b2F.jpg_300x300.jpg,https://www.alibaba.com/product-detail/Fall-New-Half-Skirt-French-Khaki_1601342237725.html,2025-02-19T09:48:41.238Z
SpringSpring Women's Casual Long Fashion Skirt With French Hollow Embroidery Color Everything Goes Girlg New Design,19.44,"Guangzhou Fanximan Clothing Co., Ltd",Min. order: 2 pieces,4.4,,https://s.alicdn.com/@sc04/kf/H76cf49d5ec59412cbf559588d530ead4A.jpg_300x300.jpg,https://www.alibaba.com/product-detail/SpringSpring-Women-s-Casual-Long-Fashion_1601298482051.html?selectedCarrierCode=SEMI_MANAGED_STANDARD@@STANDARD,2025-02-19T09:48:41.354Z
Women's Skirts Girls Club Mini Sexy Short Home Dress Plus Size Elegant Sleep Romper,4.98-9.98,"Guangzhou Boslun Industrial Co., Ltd.",Min. order: 100 pieces,4.9,0,https://s.alicdn.com/@sc04/kf/Hf759961962ff4260bf65410541c79a4e8.jpg_300x300.jpg,https://www.alibaba.com/product-detail/Women-s-Skirts-Girls-Club-Mini_1600512054712.html?s=p,2025-02-19T09:48:41.503Z
Women Solid Color Long Skirts High Waist Bodycon Straigh Split Korean Fashion Elegant for Summer Autumn,6.58,"Shenzhen Chunyu Electronic Technology Co., Ltd.",Min. order: 2 pieces,4.7,,https://s.alicdn.com/@sc04/kf/H7b2e8335968944e189cdfdc521747c51k.png_300x300.png,https://www.alibaba.com/product-detail/Women-Solid-Color-Long-Skirts-High_1601225091613.html?selectedCarrierCode=SEMI_MANAGED_STANDARD@@STANDARD,2025-02-19T09:48:41.628Z
High Quality Custom Women's Pleated Tennis Casual Nylon Golf Workout Dress Anti-Static Sustainable Features Natural,5.46-7.55,"Dongguan Chenen Sports Goods Co., Ltd",Min. order: 50 pieces,5.0,0,https://s.alicdn.com/@sc04/kf/H664056f82c5e4dbfac18c57680f646710.png_300x300.png,https://www.alibaba.com/product-detail/High-Quality-Custom-Women-s-Pleated_1601289530191.html?s=p,2025-02-19T09:48:41.768Z
Sexy Active Workout Fitness Two Piece Long Sleeves Yoga Women Tennis Dress Set,12.12-15.62,"Dongguan Betteractive Fashion Co., Ltd.",Min. order: 50 pieces,4.8,,https://s.alicdn.com/@sc04/kf/S9b885b43d11542068eca07d7ee9d8547D.jpg_300x300.jpg,https://www.alibaba.com/product-detail/Sexy-Active-Workout-Fitness-Two-Piece_10000017432676.html,2025-02-19T09:48:41.916Z
Sportswear Leisure Training Beautiful Back Golf Womens Sports Yoga Dresses A-Line Tennis For Women,23.50-27.50,"Dongguan Roregal Garments Co.,Ltd",Min. order: 2 pieces,4.6,,https://s.alicdn.com/@sc04/kf/H1118b50200d542148de9f8f0b1a0621ba.jpg_300x300.jpg,https://www.alibaba.com/product-detail/Sportswear-Leisure-Training-Beautiful-Back-Golf_1600952291634.html?s=p,2025-02-19T09:48:42.050Z
Women's Frost Pencil Skirt in Elegant Style Top Trending Fall Collection for Office Casual Made in Vietnam,98.00-116.00,ANNA IMPERIA COMPANY LIMITED,Min. order: 2 pieces,5.0,0,https://s.alicdn.com/@sc04/kf/Ace6311e447974f42be917b524aeccb99k.jpg_300x300.jpg,https://www.alibaba.com/product-detail/Women-s-Frost-Pencil-Skirt-in_10000020566780.html,2025-02-19T09:48:42.205Z
Bomblook Q22SK135 New Arrival Low Waist Solid Color Pocket Bodycon Maxi Women Casual,5.80,"Guangdong Mississippi E-Commerce Co., Ltd.",Min. order: 2 pieces,4.5,,https://s.alicdn.com/@sc04/kf/H42aadcf2011246feb6131b75824d6e6cO.jpg_300x300.jpg,https://www.alibaba.com/product-detail/Bomblook-Q22SK135-New-Arrival-Low-Waist_1600457836052.html?selectedCarrierCode=SEMI_MANAGED_STANDARD@@STANDARD,2025-02-19T09:48:42.375Z
2 Piece Set Short Pencil Dress Set Skirt and Black Long Sleeve Mesh Short Top for Women,7.70,"Guangzhou Yiyang Clothing Co., Ltd.",Min. order: 2 pieces,5.0,0,https://s.alicdn.com/@sc04/kf/H8935c89de92f4bcaa1c86f67f4b963f5w.jpg_300x300.jpg,https://www.alibaba.com/product-detail/2-Piece-Set-Short-Pencil-Dress_1601263394829.html?selectedCarrierCode=SEMI_MANAGED_STANDARD@@STANDARD,2025-02-19T09:48:42.498Z
"Women Soft and Eco-Friendly Bamboo Midi Skirt - Lightweight, Breathable, Perfect for Hot Summer Days",5.00,OITA SPORTS INDUSTRIES,Min. order: 50 pieces,4.9,0,https://s.alicdn.com/@sc04/kf/S91dd080cf2e047bd8addb03fbd2d460bf.jpg_300x300.jpg,https://www.alibaba.com/product-detail/Women-Soft-and-Eco-Friendly-Bamboo_11000015386174.html,2025-02-19T09:48:42.624Z
Summer New Women's Long Denim Skirt Vintage High Waist Jeans Women's Straight Tube Large A-line,2.68,"Shenzhen Chaoxi Baimao Clothing Co., Ltd.",Min. order: 50 pieces,2.4,,https://s.alicdn.com/@sc04/kf/Hd38548d6471f4304bed30d5b6b48bdf1g.jpg_300x300.jpg,https://www.alibaba.com/product-detail/Summer-New-Women-s-Long-Denim_1601372287317.html?selectedCarrierCode=SEMI_MANAGED_STANDARD@@STANDARD,2025-02-19T09:48:42.755Z
L2006 Sexy Hot Pink Midi Bodycon Chic Pencil Skirts for Women Elegant Evening Formal Party Wear Fashion Office Summer Dress,6.80,"Guangzhou Zhuofei Clothes Co., Ltd.",Min. order: 1 piece,4.7,,https://s.alicdn.com/@sc04/kf/H39eb1d472ff54297a077f7f04318b9acp.jpg_300x300.jpg,https://www.alibaba.com/product-detail/L2006-Sexy-Hot-Pink-Midi-Bodycon_1600530557361.html?selectedCarrierCode=SEMI_MANAGED_STANDARD@@STANDARD,2025-02-19T09:48:42.886Z
New Women's Skirts Fashion Casual Plus Size Denim Elegant Single-breasted Long,9.01,"Guangzhou Pzf Garment Co., Ltd.",Min. order: 1 piece,4.4,,https://s.alicdn.com/@sc04/kf/Hdc472b498e794346bda27c737d54d07aq.jpg_300x300.jpg,https://www.alibaba.com/product-detail/New-Women-s-Skirts-Fashion-Casual_1600089894966.html?selectedCarrierCode=SEMI_MANAGED_STANDARD@@STANDARD,2025-02-19T09:48:43.048Z
Women's Sexy Midi Bodycon Pencil Skirts Ladies 2024 New High Waist Slim Fit Club Party Workout Bandage,5.85,"Xiamen Ouxu Import And Export Co., Ltd.",Min. order: 2 pieces,4.5,,https://s.alicdn.com/@sc04/kf/Hafae4b01ffa5494784da9166c54beed3m.jpg_300x300.jpg,https://www.alibaba.com/product-detail/Women-s-Sexy-Midi-Bodycon-Pencil_1600426581785.html?selectedCarrierCode=SEMI_MANAGED_STANDARD@@STANDARD,2025-02-19T09:48:43.197Z
D41007 Autumn and Winter Knitted Skirt Women 2024 Autumn High-grade Sense High Waist Collocation Color Mid-length Pleated,7.35,"Guangzhou Cheerfeel Trading Co., Ltd.",Min. order: 3 pieces,4.5,0,https://s.alicdn.com/@sc04/kf/H44224ff3fcd34fdf9b77e80e61431882r.jpg_300x300.jpg,https://www.alibaba.com/product-detail/D41007-Autumn-and-Winter-Knitted-Skirt_1601273886632.html?selectedCarrierCode=SEMI_MANAGED_STANDARD@@STANDARD,2025-02-19T09:48:43.317Z
OUDINA New Arrivals Velvet Vintage Casual Midi Long Women Office for Ladies Vintage,29.90,"Guangzhou Oudina Clothing Co., Ltd.",Min. order: 1 piece,4.5,,https://s.alicdn.com/@sc04/kf/H4595c766b547440fa0f33e0b8d411dbaJ.jpg_300x300.jpg,https://www.alibaba.com/product-detail/OUDINA-New-Arrivals-Velvet-Vintage-Casual_1600497625938.html?selectedCarrierCode=SEMI_MANAGED_STANDARD@@STANDARD,2025-02-19T09:48:43.438Z
Ladies Sexy Slim Pleated Mini Tight Drawstring Summer Women Short,4.50,"Aini (Dongguan) Garment Co., Ltd.",Min. order: 2 pieces,4.6,,https://s.alicdn.com/@sc04/kf/H55f5352c50824de79e8e491c2515fb513.jpg_300x300.jpg,https://www.alibaba.com/product-detail/Ladies-Sexy-Slim-Pleated-Mini-Tight_1601236463931.html,2025-02-19T09:48:43.568Z
Autumn Fashion New Midi Skirt Cotton Linen Straight High Waist Split Hem,12.50,Guangzhou Guga Internet And Technology Limited,Min. order: 1 piece,4.3,,https://s.alicdn.com/@sc04/kf/Ha4fd25e1f0a440a4aca6286f43e296aeA.jpg_300x300.jpg,https://www.alibaba.com/product-detail/Autumn-Fashion-New-Midi-Skirt-Cotton_1601251505334.html?selectedCarrierCode=SEMI_MANAGED_STANDARD@@STANDARD,2025-02-19T09:48:43.694Z
Solid Color Irregular Hem Pencil Evening Dress Women One Shoulder Bodycon Slash Collar Midi,9.92,Xiamen Maile Trading Company Ltd.,Min. order: 2 pieces,4.8,0,https://s.alicdn.com/@sc04/kf/Hc5db94b8cd084a3dae99dcb60fb4558fv.jpg_300x300.jpg,https://www.alibaba.com/product-detail/Solid-Color-Irregular-Hem-Pencil-Evening_1601137284838.html?selectedCarrierCode=SEMI_MANAGED_STANDARD@@STANDARD,2025-02-19T09:48:43.819Z
Maden Wholesale Women's A-line Fishtail Skirt Solid High-Waisted Hip-Hugging Slim-Fit Versatile Long Summer Spring,11.41,"Chongqing Retro Rules Trading Co., Ltd.",Min. order: 2 pieces,4.9,,https://s.alicdn.com/@sc04/kf/H2f7439cecbb044dc9aa7c701599ca5b6K.jpg_300x300.jpg,https://www.alibaba.com/product-detail/Maden-Wholesale-Women-s-A-line_1601126017100.html?selectedCarrierCode=SEMI_MANAGED_STANDARD@@STANDARD,2025-02-19T09:48:43.954Z
Women's Solid Color Plus Size Pencil Skirt New Sexy Office Lady Wrap Dress for Adults,6.00,"Guangzhou Manyigui Clothing Co., Ltd.",Min. order: 2 pieces,3.9,,https://s.alicdn.com/@sc04/kf/H1a79da0e0ccc472caf8e58a59e436568E.jpg_300x300.jpg,https://www.alibaba.com/product-detail/Women-s-Solid-Color-Plus-Size_1601219819466.html?selectedCarrierCode=SEMI_MANAGED_STANDARD@@STANDARD,2025-02-19T09:48:44.080Z
Cotton Casual Dress A-line Skirt Bohemian Dress V Neck Loose Cotton Linen Sleeveless Spaghetti Straps Ruffles Beach Dress,7.99,Kingdom Smart International Ltd.,Min. order: 2 pieces,4.5,,https://s.alicdn.com/@sc04/kf/H4ad791656c7d472d960078398fb724966.jpg_300x300.jpg,https://www.alibaba.com/product-detail/Cotton-Casual-Dress-A-line-Skirt_1600500486598.html?selectedCarrierCode=SEMI_MANAGED_STANDARD@@STANDARD,2025-02-19T09:48:44.218Z
New Coming High Waist Ladies Office Formal Bowknot Mini,16.50,Guangzhou Taikaixing Trade Ltd,Min. order: 1 piece,4.8,0,https://s.alicdn.com/@sc04/kf/H70fdc94bb2fc424aa1d03cfba0d62372E.jpg_300x300.jpg,https://www.alibaba.com/product-detail/New-Coming-High-Waist-Ladies-Office_1600309926966.html?selectedCarrierCode=SEMI_MANAGED_STANDARD@@STANDARD,2025-02-19T09:48:44.332Z
High-Quality Sexy Slit Solid Color Mini Skirt Women Slim High Waist Short,9.80,"Pujiang Xinrui Garments Co., Ltd.",Min. order: 6 pieces,4.8,0,https://s.alicdn.com/@sc04/kf/Hb1c536488dd9495093b2de24249be2c9Y.jpg_300x300.jpg,https://www.alibaba.com/product-detail/High-Quality-Sexy-Slit-Solid-Color_1600865006878.html,2025-02-19T09:48:44.459Z
Elegant Midi Skirt with Side Slit Elastic Waist Solid Versatile High Elastic Pleated Hip Long for Women Fast Delivery,13.11,PY INDUSTRY LIMITED,Min. order: 2 pieces,5.0,0,https://s.alicdn.com/@sc04/kf/H19b0e67597f44842a065112057ca8049o.jpg_300x300.jpg,https://www.alibaba.com/product-detail/Elegant-Midi-Skirt-with-Side-Slit_1601369349164.html,2025-02-19T09:48:44.586Z
Custom Women's Denim Maxi Skirt Design Summer 97% Cotton Denim Washed Shorts Street Wear Jean High Waisted Denim Maxi,12.00,"Zhongshan Zongzhi Clothing Co., Ltd.",Min. order: 50 pieces,4.8,,https://s.alicdn.com/@sc04/kf/H2ba4b6b46575418bb17d52e56929ff30V.jpg_300x300.jpg,https://www.alibaba.com/product-detail/Custom-Women-s-Denim-Maxi-Skirt_1601200633106.html,2025-02-19T09:48:44.713Z
Factory Outlet Cheap Solid High Waist Tight Maxi OEM Long for Women Autumn,6.25,"Xiamen Tengqiao Clothes Co., Ltd.",Min. order: 2 pieces,4.8,,https://s.alicdn.com/@sc04/kf/H7e59b710857a4c82be84aec822453d01B.jpg_300x300.jpg,https://www.alibaba.com/product-detail/Factory-Outlet-Cheap-Solid-High-Waist_1600672973695.html,2025-02-19T09:48:44.850Z
New Arrivals Short Skirts for Women Sexy Ruched Bodycon Elasticity Tight Casual Club,5.20,"Hangzhou Tabo Electronic Commerce Co., Ltd.",Min. order: 1 piece,4.7,,https://s.alicdn.com/@sc04/kf/Hbc7233f45f754fd3ae39e21bd9943a9bF.jpg_300x300.jpg,https://www.alibaba.com/product-detail/New-Arrivals-Short-Skirts-for-Women_1600773040761.html?selectedCarrierCode=SEMI_MANAGED_STANDARD@@STANDARD,2025-02-19T09:48:44.980Z
Autumn and Winter New Round Neck Lantern Sleeves Slim Fit Temperament Hip Hugging Short,8.70,Shenzhen Longgang Preti Garment Factory,Min. order: 1 bag,4.6,,https://s.alicdn.com/@sc04/kf/H66f35ed6faa848d3b68df2f34e692ebeZ.jpg_300x300.jpg,https://www.alibaba.com/product-detail/Autumn-and-Winter-New-Round-Neck_1601257363160.html?selectedCarrierCode=SEMI_MANAGED_STANDARD@@STANDARD,2025-02-19T09:48:45.115Z
Indigo Midi-Length Floral Pencil Skirt with Elastic Waist Back Slit Zippered Casual Floral Lace Bow for Summer Tennis,33.22,GUZELLER TEKSTIL SANAYI VE TICARET ANONIM SIRKETI,Min. order: 2 pieces,nil,0,https://s.alicdn.com/@sc04/kf/A82d10adcb25d4feabd374bfb310a7b81M.jpg_300x300.jpg,https://www.alibaba.com/product-detail/Indigo-Midi-Length-Floral-Pencil-Skirt_11000018746638.html,2025-02-19T09:48:45.243Z
Boutique Multicolor Solid Ribbed Knitted Fabric Baby Girls Dress High Waist Kids Baby Color,4.99,"Yiwu Shangshan Trade Co., Ltd.",Min. order: 30 pieces,4.8,,https://s.alicdn.com/@sc04/kf/Hf461d4b765c74a3b806cf2785f079bce9.jpg_300x300.jpg,https://www.alibaba.com/product-detail/Boutique-Multicolor-Solid-Ribbed-Knitted-Fabric_1601260786629.html?selectedCarrierCode=SEMI_MANAGED_STANDARD@@STANDARD,2025-02-19T09:48:45.378Z
New Women's Dresses Solid Colour Sleeveless Elegant Pleated Office Dresses Fashion Bow Design Hip,5.80,"Dongguan Skyland Clothing Co., Ltd.",Min. order: 2 pieces,4.9,0,https://s.alicdn.com/@sc04/kf/Hbb99b6e34d4a4557a522586ea16f700ba.jpg_300x300.jpg,https://www.alibaba.com/product-detail/New-Women-s-Dresses-Solid-Colour_1601162936161.html?selectedCarrierCode=SEMI_MANAGED_STANDARD@@STANDARD,2025-02-19T09:48:45.502Z
Turkish Long Skirt Organza a Line Elegant Plaid High Waist Wrap Casual Warm Woolen Maxi Long for Ladies Girls,5.90,"Guangzhou Rongge Apparel Co., Ltd.",Min. order: 2 pieces,4.6,,https://s.alicdn.com/@sc04/kf/H48a66fb95e9b4669ba227c54a6fa21f8v.jpg_300x300.jpg,https://www.alibaba.com/product-detail/Turkish-Long-Skirt-Organza-a-Line_1601049742056.html?selectedCarrierCode=SEMI_MANAGED_STANDARD@@STANDARD,2025-02-19T09:48:45.635Z
ZYHT 30020 Two Piece Skirt Set Ladies Office Business Blazers Suits Set Women Casual 2 Piece Blazer Set,30.00,"Guangzhou Changxin Information Technology Co., Ltd.",Min. order: 1 set,4.7,0,https://s.alicdn.com/@sc04/kf/Hd12a6dbe1a8e4cd3adf42009949682b2Y.jpg_300x300.jpg,https://www.alibaba.com/product-detail/ZYHT-30020-Two-Piece-Skirt-Set_1600777634108.html?selectedCarrierCode=SEMI_MANAGED_STANDARD@@STANDARD,2025-02-19T09:48:45.742Z
Liu Ming New Popular Summer Women Sexy Bra Printed Long Dress Two Piece Set,9.89,"Jinjiang Liuming Trading Co., Ltd.",Min. order: 1 set,4.1,,https://s.alicdn.com/@sc04/kf/H63c11d0eab8d41368645db877c2e6268t.jpg_300x300.jpg,https://www.alibaba.com/product-detail/Liu-Ming-New-Popular-Summer-Women_1600200861000.html?selectedCarrierCode=SEMI_MANAGED_STANDARD@@STANDARD,2025-02-19T09:48:45.870Z
Women's 2024 Summer New Short-sleeved V-neck Waist Color OL commuter African Dress,1.30-1.70,Guangzhou Xinyien Trading Firm,Min. order: 100 pieces,nil,0,https://s.alicdn.com/@sc04/kf/Hfde242bb0428422880bd4f19f97be39bH.jpg_300x300.jpg,https://www.alibaba.com/product-detail/Women-s-2024-Summer-New-Short_1601215668846.html,2025-02-19T09:48:45.985Z
Knitted High-Waisted Fashionable Skirt A-line,3.09,"Neijiang Binduo Trading Co., Ltd.",Min. order: 3 pieces,4.2,,https://s.alicdn.com/@sc04/kf/Ha7992d7b1a82436fb2b67f78cb046e5cl.jpg_300x300.jpg,https://www.alibaba.com/product-detail/Knitted-High-Waisted-Fashionable-Skirt-A_1601350883220.html?selectedCarrierCode=SEMI_MANAGED_STANDARD@@STANDARD,2025-02-19T09:48:46.097Z
Custom Clothing Women's Elegant Black Ribbed Knit with Buttoned Front Slit Design a Must Have for 2025 Chic Looks,4.89,"Guangzhou Aoxi Clothing Co., Ltd.",Min. order: 2 pieces,5.0,0,https://s.alicdn.com/@sc04/kf/Ha5340363bae14218bba475dd5e6740c4G.jpg_300x300.jpg,https://www.alibaba.com/product-detail/Custom-Clothing-Women-s-Elegant-Black_1601364473456.html,2025-02-19T09:48:46.202Z
Wholesale 2025 Women Pleated Solid Color High Waist Bodycon Casual Long Maxi a Line,6.48,"Huzhou Jindou Network Technology Co., Ltd.",Min. order: 2 pieces,4.0,,https://s.alicdn.com/@sc04/kf/Ha632e2b56a8b4a159df55e06a2bea421C.jpg_300x300.jpg,https://www.alibaba.com/product-detail/Wholesale-2025-Women-Pleated-Solid-Color_1601193887865.html?selectedCarrierCode=SEMI_MANAGED_STANDARD@@STANDARD,2025-02-19T09:48:46.329Z