title,price,company,moq,rating,nop,image,link,scrapedAt
High Quality Little Girls Dress up Cosplay Princess Fancy Halloween Prom Party Costumes Green Fairy,8.36,"Huizhou Shenyuan Toys Co., Ltd.",Min. order: 2 sets,4.8,108,https://s.alicdn.com/@sc04/kf/He177fc11f11d4e728c4f696ff5a9d79bc.jpg_300x300.jpg,https://www.alibaba.com/product-detail/High-Quality-Little-Girls-Dress-up_1601045014553.html?selectedCarrierCode=SEMI_MANAGED_STANDARD@@STANDARD,2025-02-23T16:02:02.378Z
New Fashion Girls Christmas Red Velvet Dress Kids Sleeve Velour With Bow 1-6 Years,5.80,"Zhengzhou Beautiful Style Trade Co., Ltd.",Min. order: 5 pieces,4.8,0,https://s.alicdn.com/@sc04/kf/H3ff34276c62c43279e7ba4f8898fd97bP.jpg_300x300.jpg,https://www.alibaba.com/product-detail/New-Fashion-Girls-Christmas-Red-Velvet_1600447499130.html,2025-02-23T16:02:02.635Z
Western Style Red Girl Prom Party Dresses Sequin Princess Gown Tulle Sleeved Princess Birthday Big,10.79,Shenzhen Bao'an District Xin'an Baihui Children's Clothing Factory,Min. order: 2 pieces,4.7,4,https://s.alicdn.com/@sc04/kf/H98c1b9e1cc634a788127f28eb38abed2F.jpg_300x300.jpg,https://www.alibaba.com/product-detail/Western-Style-Red-Girl-Prom-Party_1600559251397.html?selectedCarrierCode=SEMI_MANAGED_STANDARD@@STANDARD,2025-02-23T16:02:02.922Z
RTS Baby Girls Short Sleeve Red Pocket Design Crawfish Ruffle Gown Knee Length Boutique Kids Clothing Boutique Trendy,7.50,"Yiwu Yawoo Clothing Co., Ltd.",Min. order: 2 pieces,4.9,4,https://s.alicdn.com/@sc04/kf/H0380b9409d1d40fc9ac5032c41f62192q.jpg_300x300.jpg,https://www.alibaba.com/product-detail/RTS-Baby-Girls-Short-Sleeve-Red_1601282063231.html?selectedCarrierCode=SEMI_MANAGED_STANDARD@@STANDARD,2025-02-23T16:02:03.185Z
GSD0314 Fashionable Girls Dresses Short Sleeve Back to School Pencil Apple Print With Children Clothes Rts No Moq,8.50,"Yiwu City Aier Clothing Co., Ltd.",Min. order: 2 pieces,5.0,0,https://s.alicdn.com/@sc04/kf/Hd8ebe323e43b42d98c49773ba32a8fbd7.jpg_300x300.jpg,https://www.alibaba.com/product-detail/GSD0314-Fashionable-Girls-Dresses-Short-Sleeve_1601353748609.html?selectedCarrierCode=SEMI_MANAGED_STANDARD@@STANDARD,2025-02-23T16:02:03.436Z
Red Children's Dress 2025 Summer New Korean Style Back Big butterfly Sleeve Wavy Princess,11.00,"Shenzhen Duoduo Princess Children Clothing Co., Ltd.",Min. order: 5 pieces,4.6,0,https://s.alicdn.com/@sc04/kf/H79f60b7d557e441d80e5091e7a2d57334.jpg_300x300.jpg,https://www.alibaba.com/product-detail/Red-Children-s-Dress-2025-Summer_1601282253035.html?selectedCarrierCode=SEMI_MANAGED_STANDARD@@STANDARD,2025-02-23T16:02:03.684Z
Sexy Off Shoulder Silk Ribbon Crossover Strap Body-hugging Sexy Hot Solid Color Spicy Party Club,7.98,"Xiamen Laiyingyu Trading Co., Ltd.",Min. order: 2 pieces,4.7,0,https://s.alicdn.com/@sc04/kf/He98c5bf20f5e4484a9599a53d0f3f831t.jpg_300x300.jpg,https://www.alibaba.com/product-detail/Sexy-Off-Shoulder-Silk-Ribbon-Crossover_1601338061528.html?selectedCarrierCode=SEMI_MANAGED_STANDARD@@STANDARD,2025-02-23T16:02:03.944Z
Hot Red Backless Halter Mesh Floral Mini Short Ladies Women's Nighty Going Out Open Breast Sexy Women,4.61,"Wanlijia Garment (Guangzhou) Co., Ltd.",Min. order: 1 piece,4.9,0,https://s.alicdn.com/@sc04/kf/Hd1ff95162617405fba00afec9bf78531f.jpg_300x300.jpg,https://www.alibaba.com/product-detail/Hot-Red-Backless-Halter-Mesh-Floral_1601023400063.html,2025-02-23T16:02:04.296Z
Winter New Girl Red Pink Elegant Long Sleeve High Collar Knee Length Casual Cute Princess Lace,12.13,"Xiamen Xingyibao Garments Co., Ltd.",Min. order: 2 pieces,4.6,0,https://s.alicdn.com/@sc04/kf/H87403b8e77a14738957702353e85262b3.jpg_300x300.jpg,https://www.alibaba.com/product-detail/Winter-New-Girl-Red-Pink-Elegant_1601256765133.html?selectedCarrierCode=SEMI_MANAGED_STANDARD@@STANDARD,2025-02-23T16:02:04.711Z
Pure Desire Sexy Red Open File Free Girl Suit Dress Mature Christmas Uniform Seduction Hollow Bras Passion Temptation,5.20,"Qingdao Aitelai Trading Co., Ltd.",Min. order: 5 pieces,5.0,0,https://s.alicdn.com/@sc04/kf/H78befddab6194ef19f9a823d4cfc5bc5J.jpg_300x300.jpg,https://www.alibaba.com/product-detail/Pure-Desire-Sexy-Red-Open-File_1601290053685.html?selectedCarrierCode=SEMI_MANAGED_STANDARD@@STANDARD,2025-02-23T16:02:05.168Z
MQATZ Hot Sale Red Short Sleeve Tulle Party Dress for Fashionable Ball Gown Ages 3 Years+ L2298XZ,9.08,"Guangzhou Meiqiai Garment Co., Ltd.",Min. order: 30 pieces,4.9,2,https://s.alicdn.com/@sc04/kf/H61ee02fc6967461dacd88299c5144685i.jpg_300x300.jpg,https://www.alibaba.com/product-detail/MQATZ-Hot-Sale-Red-Short-Sleeve_1601243023481.html,2025-02-23T16:02:05.467Z
Online Wholesale 2-8 Year Red Summer Short Sleeve a Line Solid Color Children's Clothes Birthday Party Casual,5.90,"Fujian Jinghui Investment Co., Ltd.",Min. order: 20 pieces,4.6,1,https://s.alicdn.com/@sc04/kf/H2bd0de4d281d4303bcced9b8043d1ffaS.jpg_300x300.jpg,https://www.alibaba.com/product-detail/Online-Wholesale-2-8-Year-Red_1601111518251.html,2025-02-23T16:02:05.837Z
Sexy Sparkly Silk Knit Camisole Mini Dress 2025new Ins Net Skirt Hot Knitted Halter Waist Womens,9.30,"Yiwu Xuanxin Trading Co., Ltd.",Min. order: 2 pieces,4.2,0,https://s.alicdn.com/@sc04/kf/H1fa0d7ad1e604ad0965e80ebee56918et.jpg_300x300.jpg,https://www.alibaba.com/product-detail/Sexy-Sparkly-Silk-Knit-Camisole-Mini_1601296471021.html,2025-02-23T16:02:06.117Z
Red Christmas Smocked Baby Dresses for Girl Short or Long Sleeve Ruffles With Bow Back Kids Clothes Wholesale,25.00,"Wuxi Aibao Garments Co., Ltd.",Min. order: 2 pieces,4.9,0,https://s.alicdn.com/@sc04/kf/He79209bfdfc74aff88a28f0282a147248.jpg_300x300.jpg,https://www.alibaba.com/product-detail/Red-Christmas-Smocked-Baby-Dresses-for_1600154941718.html,2025-02-23T16:02:06.394Z
Customized Cotton Red Short Smocked Dress for Baby Age Group Children From Vietnam Manufacturer,10.00-15.00,TRUNG GIANG PRODUCTION AND TRADE COMPANY LIMITED.,Min. order: 10 pieces,5.0,0,https://s.alicdn.com/@sc04/kf/H1438c6ff44ed462283183d0862de272a2.png_300x300.png,https://www.alibaba.com/product-detail/Customized-Cotton-Red-Short-Smocked-Dress_1601068717408.html,2025-02-23T16:02:06.695Z
Baby Girls Summer Sweet Red Dress Girls Floral Princess Kids Newborn Sleeve Flower Cotton,3.83,"Foshan Xiaomaiya Clothing Co., Ltd.",Min. order: 20 pieces,4.4,5,https://s.alicdn.com/@sc04/kf/He1866baeef464aa6bbb51e97c8ab4d5dD.jpg_300x300.jpg,https://www.alibaba.com/product-detail/Baby-Girls-Summer-Sweet-Red-Dress_1600973243284.html,2025-02-23T16:02:07.021Z
Short Sleeve Korean Red Plaid Two Piece Casual Girls Kids Clothing Sets,7.63,"Quanzhou Wanmao Clothing Co., Ltd.",Min. order: 3 pieces,4.8,45,https://s.alicdn.com/@sc04/kf/H80f8fa3c109e4e938ae2d0eb869755d09.jpg_300x300.jpg,https://www.alibaba.com/product-detail/Short-Sleeve-Korean-Red-Plaid-Two_1600288436769.html,2025-02-23T16:02:07.252Z
Beam Thin Skirt Temperament Short Dress Women's Sexy 2023 Summer Off -shoulder Collarbone Hot Suspender V -neck Rose,26.00-33.00,"Guangzhou Miying Fashion Co., Ltd.",Min. order: 10 pieces,5.0,4,https://s.alicdn.com/@sc04/kf/Hbc400ebfb77c43618fe71f73876d09b9a.jpg_300x300.jpg,https://www.alibaba.com/product-detail/Beam-Thin-Skirt-Temperament-Short-Dress_1600751239202.html,2025-02-23T16:02:07.513Z
Summer Dresses for Women 2022new Ins Net Red Short Skirt Hot Knitted Halter Waist Womens,8.50,Hangzhou Yuhang Yishan Clothing Firm,Min. order: 2 pieces,4.6,19,https://s.alicdn.com/@sc04/kf/H1fa0d7ad1e604ad0965e80ebee56918et.jpg_300x300.jpg,https://www.alibaba.com/product-detail/Summer-Dresses-for-Women-2022new-Ins_1600520509741.html,2025-02-23T16:02:07.781Z
Family Matching Summer Outfits Short Sleeve Shirt Boys Sexy Little Party Polynesian Tribal Hibiscus Customize,37.99,"Quanzhou Jingpu Supply Chain Management Co., Ltd.",Min. order: 1 piece,4.8,0,https://s.alicdn.com/@sc04/kf/H3426313d4fb349d7ba5e91c922c4ef87X.jpg_300x300.jpg,https://www.alibaba.com/product-detail/Family-Matching-Summer-Outfits-Short-Sleeve_1600740767208.html,2025-02-23T16:02:08.040Z
2025 Summer New Chinese-style Stand Collar Style Cheongsam Sleeve Style Small Skirt,4.80,"Henan Fat Baby Clothing Co., Ltd.",Min. order: 8 pieces,4.9,0,https://s.alicdn.com/@sc04/kf/H1ae82aa753bd48d69610c4a2462d70dbS.jpg_300x300.jpg,https://www.alibaba.com/product-detail/2025-Summer-New-Chinese-style-Stand_1601348834617.html,2025-02-23T16:02:08.399Z
Red Short Sleeve Luxury Wedding Dress Flower Girl Kids Apparel Clothes High-quality Party,29.59,"Dongguan Chaoyuan Clothing Co., Ltd.",Min. order: 12 pieces,4.6,0,https://s.alicdn.com/@sc04/kf/H53c73b9328ee47908885aa34ebdc3039Y.jpg_300x300.jpg,https://www.alibaba.com/product-detail/Red-Short-Sleeve-Luxury-Wedding-Dress_1600433850026.html,2025-02-23T16:02:08.645Z
Girl Luxury Purple Red pink Pearl Party Wedding Dress Bridal Piano Birthday Cake Princess Evening,42.00,"Huizhou Xinmeisheng Trading Co., Ltd.",Min. order: 2 pieces,4.6,0,https://s.alicdn.com/@sc04/kf/H66c42bc3e1e6475cb690f5cf7c8f4382a.jpg_300x300.jpg,https://www.alibaba.com/product-detail/Girl-Luxury-Purple-Red-pink-Pearl_1601232110829.html,2025-02-23T16:02:08.888Z
2020 Fashion Formal Kids Clothing Short Sleeve Velvet 0-2 Years Baby With Bead,26.69-28.89,"Ou Tong Import & Export Trading(guangzhou) Co., Ltd.",Min. order: 100 pieces,4.8,0,https://s.alicdn.com/@sc04/kf/H4f8a9a9ea191489fb671377dcb0ba8619.jpg_300x300.jpg,https://www.alibaba.com/product-detail/2020-Fashion-Formal-Kids-Clothing-Short_1600075560018.html,2025-02-23T16:02:09.140Z
Red Dress with Short Sleeves for Girls in Children's Wear 2020 Wholesale Children's Boutique Clothing,5.80,"Shaoxing Yicheng Trading Co., Ltd.",Min. order: 5 pieces,4.6,0,https://s.alicdn.com/@sc04/kf/U6a613772a1ca4d88bbb4ab3f6589035fl.jpg_300x300.jpg,https://www.alibaba.com/product-detail/Red-Dress-with-Short-Sleeves-for_62019937322.html,2025-02-23T16:02:09.395Z
Fashion Printed Princess Girl Dresses 4 Years Cotton Blend Baby Sleeve Summer Kids,6.58,"Yiwu Yiyuan Garment Co., Ltd.",Min. order: 15 pieces,4.1,0,https://s.alicdn.com/@sc04/kf/H1491d730abd94b2e8e979d1ec05568dfa.png_300x300.png,https://www.alibaba.com/product-detail/Fashion-Printed-Princess-Girl-Dresses-4_1601259673971.html,2025-02-23T16:02:09.637Z
Red Cotton Princess Ball Gown Girls Short Sleeve Off-Shoulder Christmas Sequin Parties Weddings Summer O-Neck Design,40.00-42.00,"Lu'an Wangxiaobei Children's Dress Co., Ltd.",Min. order: 2 pieces,nil,0,https://s.alicdn.com/@sc04/kf/He729ed57944a43f5aba43fd63b8e3eb1Y.png_300x300.png,https://www.alibaba.com/product-detail/Red-Cotton-Princess-Ball-Gown-Girls_1601314561655.html,2025-02-23T16:02:09.872Z
High Quality Children's Casual Dress in Red Pink With Many Floating Layers Sleeves Budget-Friendly Designed ODM,14.00-17.00,BAO TRAN PRINCESS DRESS COMPANY,Min. order: 50 pieces,nil,0,https://s.alicdn.com/@sc04/kf/A23b81746d2734273a0f75da3a20c92e1A.png_300x300.png,https://www.alibaba.com/product-detail/High-Quality-Children-s-Casual-Dress_10000018975310.html,2025-02-23T16:02:10.110Z
Hawaii Hibiscus Black and Red Kids Summer Dress Sleeve Toddler Casual Clothing Kids School 4-14 Years Old,7.99-12.99,"Quanzhou Yewei Network Technology Co., Ltd.",Min. order: 1 piece,4.6,0,https://s.alicdn.com/@sc04/kf/H5777181586564914b6ea90794cc5079dT.jpg_300x300.jpg,https://www.alibaba.com/product-detail/Hawaii-Hibiscus-Black-and-Red-Kids_1600225847465.html,2025-02-23T16:02:10.366Z
Cute Red Flower Girl Dresses for Wedding Beaded Crystal Sleeve Lace Baby Guest,123.93-124.93,"Shandong Yazhe E-Business Co., Ltd.",Min. order: 2 pieces,4.7,0,https://s.alicdn.com/@sc04/kf/H0ee1c09c60794423be648e5ee7384126S.jpg_300x300.jpg,https://www.alibaba.com/product-detail/Cute-Red-Flower-Girl-Dresses-for_1601303978950.html,2025-02-23T16:02:10.615Z
MQATZ Custom Big Red 3 D Flower Girl Princess Long Sleeve Puffy Birthday Party Wear AL011,12.69,"Yiwu Ruoque Trading Co.,ltd",Min. order: 5 pieces,3.7,0,https://s.alicdn.com/@sc04/kf/He5dde52888db42e9b72204e3bf2e3670J.jpg_300x300.jpg,https://www.alibaba.com/product-detail/MQATZ-Custom-Big-Red-3-D_1601295051526.html,2025-02-23T16:02:10.868Z
Red Smile Print Baby Girls Casual Wear Short Sleeve Solid Knit Cotton Sweet Knee Length Ruffle Twirl,7.90,"Yiwu Kerui Clothing Co., Ltd.",Min. order: 10 pieces,4.7,42,https://s.alicdn.com/@sc04/kf/H28fd175083ac494eaae684985a1fe4d0c.jpg_300x300.jpg,https://www.alibaba.com/product-detail/Red-Smile-Print-Baby-Girls-Casual_1601007635081.html,2025-02-23T16:02:11.141Z
YOEHYAUL LX0178 Short Sleeve Casual Girl Striped Child White and Black Striped Baby,5.70,"Huzhou Huiyi Clothing Co., Ltd.",Min. order: 2 pieces,4.8,7,https://s.alicdn.com/@sc04/kf/H115cfb810b1b4b3ea47403ee9340a29eY.jpg_300x300.jpg,https://www.alibaba.com/product-detail/YOEHYAUL-LX0178-Short-Sleeve-Casual-Girl_1601171893160.html,2025-02-23T16:02:11.427Z
Children's Fashionable Satin Red Birthday Dress with Bow Ruffles Appliques Summer Parties ODM Supply,27.37-32.20,"Foshan Young Sprouts Fashion International Trade Co., Ltd.",Min. order: 20 pieces,4.7,0,https://s.alicdn.com/@sc04/kf/Hc0236b0e888b44fe87c7947c1ff7edeb5.png_300x300.png,https://www.alibaba.com/product-detail/Children-s-Fashionable-Satin-Red-Birthday_1601289047109.html,2025-02-23T16:02:11.738Z
Luxury Short Flying Sleeve Sequined Flower Girl Red Wedding Kids Summer,11.69-12.46,"Guangzhou Happy Credit Apparel Co., Ltd.",Min. order: 100 pieces,4.9,1,https://s.alicdn.com/@sc04/kf/Hef8247d258884545a859c4dad79b9e27i.jpg_300x300.jpg,https://www.alibaba.com/product-detail/Luxury-Short-Flying-Sleeve-Sequined-Flower_1600813037148.html,2025-02-23T16:02:12.015Z
Custom Women'S Basic Floral Print Summer Mini Sleeve a Line Casual Modest Ladies,12.28,"Dongguan Chen Shan Apparel & Accessory Co., Ltd.",Min. order: 50 pieces,4.9,0,https://s.alicdn.com/@sc04/kf/Hea9d3b8996ba4d6e8a8d3499293a3aa2j.jpg_300x300.jpg,https://www.alibaba.com/product-detail/Custom-Women-S-Basic-Floral-Print_1601061431818.html,2025-02-23T16:02:12.268Z
Children Summer Style Short Sleeve Red Princess Frock Flower Wedding Little New Piano,17.10-19.10,Yiwu Wetong Trading Firm (Individual Business),Min. order: 2 pieces,4.8,0,https://s.alicdn.com/@sc04/kf/H85a60cd210444ad39a2881a68cb88689T.jpg_300x300.jpg,https://www.alibaba.com/product-detail/Children-Summer-Style-Short-Sleeve-Red_1601157013722.html,2025-02-23T16:02:12.515Z
Red 2024 New Embroidery Off the Shoulder Sleeveless a Line Puffy Flower Homecoming Fat,47.50-55.00,"Chaozhou Ruifang Clothes Co., Ltd.",Min. order: 30 pieces,5.0,0,https://s.alicdn.com/@sc04/kf/H11601ae9843742adad888c248fd93227R.jpg_300x300.jpg,https://www.alibaba.com/product-detail/Red-2024-New-Embroidery-Off-the_1600553686783.html,2025-02-23T16:02:12.758Z
2023 Women Custom Spring/Summer Sexy V Neck Backless Mini Casual Cut Out Puff Sleeve Mini,12.50-15.50,"Dongguan Jennifer Clothing Co., Ltd.",Min. order: 50 pieces,5.0,1,https://s.alicdn.com/@sc04/kf/H364f247c352a4c67a7ddf3a998e13df7u.jpg_300x300.jpg,https://www.alibaba.com/product-detail/2023-Women-Custom-Spring-Summer-Sexy_1600824759628.html,2025-02-23T16:02:13.023Z
Kids Clothes Girl Red Dress Girl Skirt Cotton Summer Sundress New Casual Loose Kids -sleeved Birthday Elegant,17.00,"Hangzhou Fuli E-Commerce Co., Ltd.",Min. order: 3 pieces,nil,0,https://s.alicdn.com/@sc04/kf/He1d388c3647449f6937c4ca3a415c1394.jpg_300x300.jpg,https://www.alibaba.com/product-detail/Kids-Clothes-Girl-Red-Dress-Girl_1601256513281.html,2025-02-23T16:02:13.249Z
Alibaba Indian Girls Summer Short Style Rose Red Sleeveless Cotton Evening,4.95,"Shanghai Jingzhi Apparel Co., Ltd.",Min. order: 4 pieces,4.4,0,https://s.alicdn.com/@sc04/kf/HTB19tpvQXXXXXbWapXXq6xXFXXXM.jpg_300x300.jpg,https://www.alibaba.com/product-detail/Alibaba-Indian-Girls-Summer-Short-Style_60619375576.html,2025-02-23T16:02:13.494Z
Short Sleeve Kids Girls Princess Sequin Bow Mesh Catwalk Show Birthday Party Performance,13.00,"Huizhou Wangyuan Trading Co., Ltd.",Min. order: 5 pieces,4.1,0,https://s.alicdn.com/@sc04/kf/H65f20c0869cc45d986086f285ef16351a.jpg_300x300.jpg,https://www.alibaba.com/product-detail/Short-Sleeve-Kids-Girls-Princess-Sequin_1600501294665.html,2025-02-23T16:02:13.865Z
Baby Girl Dress Cute Summer Princess Dress Wine Sleeve Baby Summer,4.59-5.29,"Foshan Yingqi Beibei Clothing Co., Ltd.",Min. order: 100 pairs,nil,0,https://s.alicdn.com/@sc04/kf/H1ed25250c0234d52b93224f1af3b7969V.jpg_300x300.jpg,https://www.alibaba.com/product-detail/Baby-Girl-Dress-Cute-Summer-Princess_1601126655405.html,2025-02-23T16:02:14.124Z
3-6 Years Old 90-120cm Girls Dresses Short Sleeves Puff Sleeves Polka Dot A-line Vintage Retro Comfy Cotton,8.15,"Shanghai Jspeed Industry Co., Ltd.",Min. order: 2 pieces,nil,0,https://s.alicdn.com/@sc04/kf/H520081af47154ecf92c0e756d614b15cz.jpg_300x300.jpg,https://www.alibaba.com/product-detail/3-6-Years-Old-90-120cm_1600440332339.html,2025-02-23T16:02:14.359Z
BSM660 New Personalized British Dress for Baby Girls 1-3 Years Cute Summer Luxury Sleeve Wine,5.29,"Shangqiu Somlin Household Products Co., Ltd.",Min. order: 2 pieces,5.0,0,https://s.alicdn.com/@sc04/kf/Hd56023e42a2346eca0e05ceedd40a619q.jpg_300x300.jpg,https://www.alibaba.com/product-detail/BSM660-New-Personalized-British-Dress-for_1601360089759.html,2025-02-23T16:02:14.609Z
Hao Baby Flower Girl Dress Cuhk Children's Short Sleeve Cake Kid Bitter Fleabane Bitter Fleabane Party,6.40-9.51,"Xi An Hao Baby Trading Co., Ltd.",Min. order: 50 pieces,4.7,2,https://s.alicdn.com/@sc04/kf/HTB157cQKb9YBuNjy0Fgq6AxcXXae.jpg_300x300.jpg,https://www.alibaba.com/product-detail/Hao-Baby-Flower-Girl-Dress-Cuhk_60793177577.html,2025-02-23T16:02:14.877Z
Casual Red Denim Dresses for Young Girls 15-Year-Old O-Neck Sleeve With Ruffles Age Group Children-Summer,12.76-14.53,"Guangzhou Gaoteng Garment Co., Ltd.",Min. order: 100 pieces,4.9,0,https://s.alicdn.com/@sc04/kf/H6600883b94454fcdbb7670e0fbddb364j.jpg_300x300.jpg,https://www.alibaba.com/product-detail/Casual-Red-Denim-Dresses-for-Young_1601153997387.html,2025-02-23T16:02:15.130Z
Hot Sale Cartoon Character Red Hat Cosplay Sexy Red With Cloak Costume Carnival Party Halloween,14.80,"Hangzhou Lifc Import& Export Co., Ltd.",Min. order: 300 pieces,4.6,0,https://s.alicdn.com/@sc04/kf/H9089a5ee99604622b8c968e407879078i.jpg_300x300.jpg,https://www.alibaba.com/product-detail/Hot-Sale-Cartoon-Character-Red-Hat_1600655516742.html,2025-02-23T16:02:15.391Z