"title","price","company","moq","rating","image","link"
"Factory Outlet Custom Logo T Shirts White T Shirt for Casual Blank T- 210gsm 100% Cotton Stylish 2022 Polyester Knitted","$0.99","Guangzhou Shuliqi Garment Co., Ltd.","Min. order: 50 pieces","4.9","https://s.alicdn.com/@sc04/kf/Hcdce25cbccf64b2996e4ad6347b930afc.jpg_300x300.jpg","https://www.alibaba.com/product-detail/Factory-Outlet-Custom-Logo-T-Shirts_1600460943755.html"
"High Quality Wholesale 100% Soft Fibre Polyester Men Tshirt Sublimation T Plain Custom Printing Blank T-","$0.90","Suzhou Dreamcolor Textile Co., Ltd.","Min. order: 10 pieces","4.2","https://s.alicdn.com/@sc04/kf/H46929a0c6237421588cbb0aacd5dba110.jpg_300x300.jpg","https://www.alibaba.com/product-detail/High-Quality-Wholesale-100-Soft-Fibre_1600885886255.html?selectedCarrierCode=SEMI_MANAGED_STANDARD@@STANDARD"
"Wholesale High Quality Men's Plain T Shirts White Tee Custom Sublimation Tshirts Blanks Oversized T- For Summer","$0.96","Guangzhou TOMAS Crafts Co., Limited","Min. order: 50 pieces","4.7","https://s.alicdn.com/@sc04/kf/Hf28662f3f64e414da2548d43bdd1e198m.jpg_300x300.jpg","https://www.alibaba.com/product-detail/Wholesale-High-Quality-Men-s-Plain_1601026321070.html"
"Promotional Vote Tee Shirts Plus Size Plain White Oversiz T- With logo Custom Logo Printed","$0.90","Fujian Auplex Appliance Co., Ltd.","Min. order: 50 pieces","4.7","https://s.alicdn.com/@sc04/kf/Haec71e64d1fb4384b9dd10c390af64226.jpg_300x300.jpg","https://www.alibaba.com/product-detail/Promotional-Vote-Tee-Shirts-Plus-Size_1700001927160.html"
"Custom Hot Selling Cheap America Apparel NEW Tee Unisex Blanks Blend Tank Top T-","$0.91","Ningbo Cmax Textile Co., Ltd.","Min. order: 100 pairs","4.9","https://s.alicdn.com/@sc04/kf/Ha72a0938e4a440879f1934e655fe8d41F.jpg_300x300.jpg","https://www.alibaba.com/product-detail/Custom-Hot-Selling-Cheap-America-Apparel_1600892548746.html"
"china factory OEM long sleeve polo shirt for men","$1.00","Shenzhen Gold-White Collar Garments Co., Ltd.","Min. order: 100 pieces","nil","https://s.alicdn.com/@sc04/kf/H8bc367757ba94b42adbcad2b958a051eB.jpg_300x300.jpg","https://www.alibaba.com/product-detail/china-factory-OEM-long-sleeve-polo_60359739026.html"
"100% polyester quick dry sublimation blank t shirt for custom DIY printing t for election","$0.99","Xiamen Bestyord Commerce And Trade Co., Ltd.","Min. order: 100 pieces","4.0","https://s.alicdn.com/@sc04/kf/H7fa90a30dff34c3a8fe2253dd8cd0b42d.jpg_300x300.jpg","https://www.alibaba.com/product-detail/100-polyester-quick-dry-sublimation-blank_1601089996376.html"
"shirt interlining series 3044/8068/8505/4262 ect collar adhesive lining textile woven fusible interlining for","$0.80","Changshu Xingyan Interlining Co., Ltd.","Min. order: 100 meters","4.9","https://s.alicdn.com/@sc04/kf/HTB1k2nyOSzqK1RjSZFHq6z3CpXa8.jpg_300x300.jpg","https://www.alibaba.com/product-detail/shirt-interlining-series-3044-8068-8505_60624223550.html"
"Custom Sublimation Blanks Round Silver Men Cufflinks Cuff Links with Gift Box Available","$0.58","Shenzhen Lopo Technology Co., Ltd.","Min. order: 100 pieces","5.0","https://s.alicdn.com/@sc04/kf/Hb143c1a6e98e43acb6300b33c7d63ad4s.jpg_300x300.jpg","https://www.alibaba.com/product-detail/Custom-Sublimation-Blanks-Round-Silver-Men_1600141901078.html"
"Unisex Plain Solid Color Elastic Ice Cool Sports Sun UV Protection Resistant Ice Silk Arm Sleeve","$0.58","Shijiazhuang Aofeite Imp & Exp Co., Ltd.","Min. order: 10 pairs","4.7","https://s.alicdn.com/@sc04/kf/Hd99ad51101f34958a8bb1fd5a48ac184g.jpg_300x300.jpg","https://www.alibaba.com/product-detail/Unisex-Plain-Solid-Color-Elastic-Ice_1601125530646.html?selectedCarrierCode=SEMI_MANAGED_STANDARD@@STANDARD"
"Origami Bird Brooch Cartoon Red White Paper Cranes Enamel Pin Women Denim Bag Lapel Pins Badge Animal Jewelry for Kids","$0.70","Yichun City Dongsheng Jewelry Co., Ltd.","Min. order: 10 pieces","4.5","https://s.alicdn.com/@sc04/kf/H7128695762f2438ea4a3c32f5bc4a3edv.jpg_300x300.jpg","https://www.alibaba.com/product-detail/Origami-Bird-Brooch-Cartoon-Red-White_1600560366233.html?selectedCarrierCode=SEMI_MANAGED_STANDARD@@STANDARD"
"Outdoors UV Sun Protection Arm Sleeves Sports Cooling Sleeve for & Women","$0.91","Shijiazhuang Aofeite Medical Device Co., Ltd.","Min. order: 50 pairs","4.6","https://s.alicdn.com/@sc04/kf/Hf840e300ad5f4bf79a35cc792854966br.png_300x300.png","https://www.alibaba.com/product-detail/Outdoors-UV-Sun-Protection-Arm-Sleeves_1600752885743.html"
"Interlock Jersey Fabric Sublimation Blank 100% Polyester Color for T- 100%polyester Micro Fiber Fabric Brushed 150gsm","$0.70","Wuxi Huierjia International Trade Co., Ltd.","Min. order: 2,000 pieces","4.6","https://s.alicdn.com/@sc04/kf/HTB1ZXvwzACWBuNjy0Faq6xUlXXaO.jpg_300x300.jpg","https://www.alibaba.com/product-detail/Interlock-Jersey-Fabric-Sublimation-Blank-100_60142795567.html"
"Single Use Non Woven Lab Shirt Unisex Disposable Scrub Suit Hospital Uniform","$0.70","xiantao topmed nonwoven protective products co.,ltd","Min. order: 10,000 pieces","5.0","https://s.alicdn.com/@sc04/kf/Hb5d362d2aa5b42af885631cec58e3b68Q.jpg_300x300.jpg","https://www.alibaba.com/product-detail/Single-Use-Non-Woven-Lab-Shirt_1601271227621.html"
"Cheap price shiny smooth soft 100% polyester satin fabric for headwear bows","$0.69","Suzhou Qianjing Textile Co., Ltd.","Min. order: 10 meters","4.7","https://s.alicdn.com/@sc04/kf/H890ab95cd2a84b49ab650019e5b19083q.jpg_300x300.jpg","https://www.alibaba.com/product-detail/Cheap-price-shiny-smooth-soft-100_1600728491979.html"
"Luxury custom printing standard white rigid foldable magnetic apparel paper boxes cardboard gift clothing t packaging box","$0.60","Guangzhou Minglai Packaging Co., Ltd.","Min. order: 2 pieces","4.9","https://s.alicdn.com/@sc04/kf/H2fba61a795794439a67d7260dbc50c4ez.jpg_300x300.jpg","https://www.alibaba.com/product-detail/Luxury-custom-printing-standard-white-rigid_1601206803201.html"
"Custom Eco-Friendly Printed Labels Clothing Garment Soft Cotton Ribbon Nylon Taffeta Satin Wash Care Label For Garment","$0.30","Guangzhou Xiangtengyun Paper & Plastic Products Co., Ltd.","Min. order: 100 pieces","4.7","https://s.alicdn.com/@sc04/kf/H8adafae3fd994537be0635d48870476eA.jpg_300x300.jpg","https://www.alibaba.com/product-detail/Custom-Eco-Friendly-Printed-Labels-Clothing_1601012496956.html"
"wholesale 50g 68% cotton 32% acrylic 4.0mm crochet hook Hollow cotton yarn DIY hand woven bag hat yarn","$0.74","Shanghai Charmkey Textile Co., Ltd.","Min. order: 1,000 pieces","4.8","https://s.alicdn.com/@sc04/kf/H9547be39b56e4c1ca3b6465ce06ab0dbr.jpg_300x300.jpg","https://www.alibaba.com/product-detail/wholesale-50g-68-cotton-32-acrylic_1601240429869.html"
"Manufacturer Large Color Printed Cardboard box Mailing Apparel Box Corrugated Custom Gift Box For Underwear","$0.05","Shanghai Yucai Industrial Co., Ltd.","Min. order: 200 pieces","4.8","https://s.alicdn.com/@sc04/kf/H4942ecb52c6a4daf8da76dae4ad50cbeV.jpg_300x300.jpg","https://www.alibaba.com/product-detail/Manufacturer-Large-Color-Printed-Cardboard-box_1601046375182.html"
"Free Sample 113x125mm Men Women Unisex Armpit Under Arm Disposable Premium Absorbent Underarm Sweat Pad","$0.04","Changzhou Dailys Care Products Co., Ltd.","Min. order: 50,000 pieces","5.0","https://s.alicdn.com/@sc04/kf/Hce2804ef75df49b6858509dda81d92ff9.jpg_300x300.jpg","https://www.alibaba.com/product-detail/Free-Sample-113x125mm-Men-Women-Unisex_1601286003604.html"
"Eco friendly luxury custom men clothing packaging t- box paper cardboard underwear gift box","$0.34","Hebei Xiechu Imp &Exp Co., Ltd.","Min. order: 1,000 pieces","4.7","https://s.alicdn.com/@sc04/kf/H55f1c750c9114d8daaaeaa66091d7fd6B.jpg_300x300.jpg","https://www.alibaba.com/product-detail/Eco-friendly-luxury-custom-men-clothing_1601159349659.html"
"in stock colorful baby clothes socks garment clothes package coated paper box underwear package paper box with partial window","$0.23","Shenzhen Gathe Printing Co., Ltd.","Min. order: 100 pieces","4.9","https://s.alicdn.com/@sc04/kf/Hffec560493844460a54c1303842bbbe7n.jpg_300x300.jpg","https://www.alibaba.com/product-detail/in-stock-colorful-baby-clothes-socks_1600524439538.html"
"Custom logo black paper box packaging for underpants underwear cardboard package boxes","$0.35","Shanghai Risen Packaging Co., Ltd.","Min. order: 500 pieces","4.9","https://s.alicdn.com/@sc04/kf/H524707478a76495cb54b00628fe735caj.jpg_300x300.jpg","https://www.alibaba.com/product-detail/Custom-logo-black-paper-box-packaging_1601352760137.html"
"Pre-printed Clear Front Blue Black White Reusable Ziplock Packaging Bags For Underwear","$0.05","Dongguang Sunshine Packaging Co., Ltd.","Min. order: 200 pieces","4.9","https://s.alicdn.com/@sc04/kf/H5703aa1d82774c03ad1ab92fc4c5b752O.jpg_300x300.jpg","https://www.alibaba.com/product-detail/Pre-printed-Clear-Front-Blue-Black_62039796287.html"